id,name,priority,who,time,status
T3516,Voluptatem nisi accusantium saepe adipisci nam impedit culpa,MUST,Natasha,1,DONE
T3517,Similique natus maiores,COULD,Joe,2,DONE
T3518,Mollitia suscipit provident rerum,COULD,Joe,1,DONE
T3519,Laboriosam nulla eos sequi quam,COULD,Joe,10,DONE
T3520,Autem,SHOULD,Natasha,1,TODO
T3521,Nemo corporis repellendus sunt blanditiis,COULD,Mike,7,TODO
T3522,Occaecati consequuntur suscipit optio eveniet nostrum,WISH,Joe,10,TODO
T3523,Quaerat molestias ullam vel quo ipsa eius impedit quis,SHOULD,Joe,15,DONE
T3524,Blanditiis alias totam,COULD,Joe,1,TODO
T3525,Qui dolores eligendi,MUST,Joe,10,DONE
T3526,Minus,WISH,Joe,1,TODO
T3527,Voluptas aut nam deserunt molestiae impedit cum,WISH,Mike,7,DONE
T3528,Autem architecto cumque saepe cumque,WISH,Natasha,10,DONE
T3529,Exercitationem doloremque praesentium quisquam,SHOULD,Joe,2,DONE
T3530,Vel architecto voluptatum,SHOULD,Joe,1,DONE
T3531,Veritatis odit ut vel excepturi neque,MUST,Joe,10,DONE
T3532,Quaerat tenetur numquam repellendus,COULD,Mike,1,DONE
T3533,Quam natus sapiente quisquam,COULD,Joe,15,DONE
T3534,Tenetur minus reiciendis impedit vero laboriosam,MUST,Natasha,2,DOING
T3535,Laboriosam amet beatae,SHOULD,Joe,2,DONE
T3536,Quibusdam a cupiditate sequi dignissimos,COULD,Joe,1,TODO
T3537,Sequi adipisci fugit nobis corporis inventore,COULD,Joe,2,TODO
T3538,Sunt repudiandae fuga,WISH,Natasha,1,DONE
T3539,Cupiditate soluta aliquid enim corporis eveniet repellat cupiditate,MUST,Natasha,1,TODO
T3540,Totam labore ullam at repellat,SHOULD,Mike,2,DONE
T3541,At atque ducimus enim temporibus,SHOULD,Natasha,15,DONE
T3542,Mollitia saepe rerum quaerat architecto dolores aliquid,COULD,Joe,7,DONE
T3543,Assumenda quaerat rerum,WISH,Joe,1,DONE
T3544,Voluptatibus quod voluptatibus,SHOULD,Natasha,15,DOING
T3545,Reprehenderit sed officia aliquid optio,COULD,Joe,10,DONE
T3546,Doloribus minima deserunt odit exercitationem laboriosam,COULD,Natasha,15,DONE
T3547,Quam saepe corrupti,COULD,Joe,10,TODO
T3548,Perspiciatis deleniti doloribus nesciunt corporis,COULD,Natasha,2,TODO
T3549,Pariatur saepe nulla animi odio,WISH,Natasha,2,DONE
T3550,Quae quia numquam nulla,COULD,Joe,10,DONE
T3551,Ratione temporibus eligendi inventore,SHOULD,Joe,2,DONE
T3552,Saepe quisquam reprehenderit,SHOULD,Joe,2,DONE
T3553,Quam quaerat quam,COULD,Joe,7,TODO
T3554,Tenetur adipisci officiis,COULD,Natasha,1,DONE
T3555,Ullam corrupti voluptatibus numquam iusto optio quibusdam aperiam praesentium sequi,WISH,Joe,1,TODO
T3556,Dolorum quam iste ipsam optio,COULD,Natasha,1,DONE
T3557,Nisi accusamus,COULD,Joe,10,DONE
T3558,Qui autem expedita ad nesciunt,WISH,Joe,10,DONE
T3559,Doloremque nisi accusamus,MUST,Joe,1,DONE
T3560,Numquam perspiciatis aspernatur molestias earum,SHOULD,Joe,1,DONE
T3561,Alias magnam,WISH,Natasha,2,DONE
T3562,Nisi voluptatibus soluta veritatis,WISH,Natasha,15,DONE
T3563,Quidem doloribus illum soluta doloribus neque,COULD,Natasha,7,DONE
T3564,Voluptatem alias deserunt,SHOULD,Joe,2,DONE
T3565,Quas asperiores rerum corrupti veritatis,WISH,Natasha,4,DOING
T3566,Cupiditate soluta,WISH,Natasha,15,TODO
T3567,Quae excepturi dignissimos,COULD,Joe,10,DONE
T3568,Temporibus quod ut ex molestias totam,SHOULD,Natasha,1,DONE
T3569,Laudantium earum rem doloremque quas nobis culpa velit,WISH,Joe,10,DONE
T3570,Magnam voluptatem,COULD,Natasha,15,DONE
T3571,Maiores voluptatem consequatur architecto,SHOULD,Joe,7,TODO
T3572,Rerum magnam repellat officiis ab ducimus blanditiis itaque ex,COULD,Mike,15,DONE
T3573,Odit esse quos nulla similique necessitatibus corrupti,COULD,Joe,1,TODO
T3574,Iure at id vitae eaque laudantium earum expedita,WISH,Joe,1,DONE
T3575,Tenetur sint ipsam nemo aspernatur deserunt quidem veritatis eum nemo,SHOULD,Natasha,1,DONE
T3576,Tempora voluptatem eos alias inventore labore,COULD,Joe,10,DONE
T3577,Similique perspiciatis atque ducimus nisi,SHOULD,Joe,7,DONE
T3578,Quasi officia facere id vitae,WISH,Joe,10,DOING
T3579,Ratione dolore velit voluptate illum iure temporibus harum,WISH,Mike,2,DONE
T3580,Voluptates pariatur,COULD,Natasha,10,DONE
T3581,Possimus reiciendis fugiat quae illum minima,MUST,Joe,2,TODO
T3582,Dignissimos fugiat quisquam saepe veniam,COULD,Mike,2,DONE
T3583,Sint eaque veritatis,COULD,Joe,15,DONE
T3584,Distinctio doloremque voluptatum,SHOULD,Natasha,15,DONE
T3585,Assumenda harum fuga assumenda recusandae iusto porro,COULD,Joe,15,DOING
T3586,Reprehenderit dolor beatae laborum culpa reiciendis exercitationem voluptatibus,SHOULD,Natasha,7,DONE
T3587,Dolorum error,WISH,Natasha,1,DONE
T3588,Expedita consequatur sit nam fugit asperiores accusamus voluptas,SHOULD,Joe,2,DONE
T3589,Atque eos rem illum natus voluptatum praesentium repellat modi,SHOULD,Joe,10,DONE
T3590,Molestiae eaque eius vero,COULD,Joe,10,DOING
T3591,Doloribus commodi non temporibus,SHOULD,Joe,2,DONE
T3592,Quos ad ad veritatis quasi blanditiis tenetur,WISH,Mike,10,DONE
T3593,Quos quis fugiat nobis deleniti,WISH,Natasha,1,DONE
T3594,Nam mollitia recusandae corrupti esse,SHOULD,Natasha,10,DONE
T3595,Illum quo accusantium aspernatur expedita,WISH,Joe,15,TODO
T3596,Voluptatem atque natus,COULD,Natasha,15,TODO
T3597,Provident soluta quod,SHOULD,Natasha,1,TODO
T3598,Eius aut nobis nemo,COULD,Mike,2,DONE
T3599,Voluptatibus quidem,COULD,Joe,7,TODO
T3600,Quibusdam autem corrupti natus ex pariatur enim magni,SHOULD,Joe,10,DONE
T3601,Totam perferendis sint ducimus quis accusamus quibusdam labore praesentium,WISH,Joe,15,DONE
T3602,Quas aperiam,COULD,Natasha,15,DONE
T3603,Ut minus libero sint cupiditate ipsam,COULD,Natasha,1,DONE
T3604,Nisi ad libero praesentium veniam praesentium quis,SHOULD,Joe,10,DONE
T3605,Nemo eaque corporis dolor dignissimos adipisci ex placeat,WISH,Joe,2,TODO
T3606,Iusto,WISH,Joe,1,DONE
T3607,Placeat praesentium necessitatibus doloribus,SHOULD,Joe,2,TODO
T3608,Ratione itaque ut vero,WISH,Mike,15,DONE
T3609,Suscipit quod maxime id,WISH,Mike,10,DONE
T3610,Consequuntur repudiandae eaque iure sequi cupiditate vitae,SHOULD,Joe,10,DONE
T3611,Explicabo eius atque,SHOULD,Joe,10,TODO
T3612,Commodi amet ad mollitia,COULD,Natasha,10,TODO
T3613,In tempora sapiente adipisci,COULD,Mike,15,DONE
T3614,Quasi doloribus praesentium,WISH,Joe,10,DONE
T3615,Labore vel dolores eius,WISH,Joe,1,DOING
T3616,Officia voluptatibus occaecati delectus,COULD,Joe,10,DONE
T3617,Cumque,WISH,Natasha,15,DONE
T3618,Corporis debitis eos quia laboriosam,SHOULD,Natasha,1,DONE
T3619,Fugiat accusamus quisquam vero eum,COULD,Joe,10,TODO
T3620,Asperiores blanditiis quaerat,SHOULD,Joe,15,DONE
T3621,Sunt voluptas numquam rem,SHOULD,Joe,2,TODO
T3622,Aperiam ducimus neque eveniet,COULD,Joe,10,DONE
T3623,Minima beatae minus optio magnam,COULD,Joe,10,DONE
T3624,Beatae quidem magni porro tempore,MUST,Joe,10,DONE
T3625,Quos beatae dolor incidunt facere,MUST,Joe,10,DONE
T3626,Quas at beatae,SHOULD,Joe,1,TODO
T3627,Quaerat dolore natus quos assumenda,MUST,Joe,10,DONE
T3628,Temporibus natus perspiciatis commodi,WISH,Mike,7,DONE
T3629,Qui nulla odio magnam eligendi officiis aliquid assumenda,COULD,Joe,7,TODO
T3630,Qui repellendus occaecati est expedita,MUST,Joe,1,TODO
T3631,Sunt consequatur tempora ea omnis ab reiciendis vel adipisci,COULD,Joe,15,DONE
T3632,Asperiores ut et expedita ratione deleniti sunt,COULD,Mike,1,DONE
T3633,Aliquam fuga,COULD,Natasha,10,DONE
T3634,Corrupti pariatur possimus ab vel in aut praesentium eligendi,COULD,Joe,15,DOING
T3635,Accusamus ex culpa,WISH,Mike,10,DONE
T3636,Saepe culpa magni ullam libero,WISH,Joe,10,DONE
T3637,Tempora laudantium nemo,COULD,Joe,10,DONE
T3638,Dolor accusamus fugit ducimus veritatis,COULD,Joe,15,DONE
T3639,Voluptate repellat consequatur cum,MUST,Joe,15,DONE
T3640,Beatae necessitatibus,COULD,Natasha,2,DONE
T3641,Quaerat quam aspernatur,WISH,Joe,10,TODO
T3642,Odit esse alias maiores nisi,WISH,Mike,15,DOING
T3643,Rerum aperiam ex corporis incidunt voluptas at,COULD,Mike,4,DONE
T3644,Modi optio perspiciatis voluptatum aspernatur,COULD,Joe,10,DONE
T3645,Tempore impedit dignissimos,COULD,Joe,10,DONE
T3646,Dolorum sed quas,COULD,Joe,10,TODO
T3647,Repellat odio delectus tempora,COULD,Natasha,15,DONE
T3648,Porro animi id,COULD,Joe,15,DONE
T3649,Voluptatum ratione ducimus velit,MUST,Mike,15,DONE
T3650,Qui sit eligendi delectus ex,SHOULD,Natasha,15,DONE
T3651,Qui culpa nam saepe itaque mollitia culpa eligendi sit,SHOULD,Joe,15,TODO
T3652,Eveniet sequi repudiandae nesciunt consequuntur atque inventore incidunt maxime harum,SHOULD,Natasha,10,TODO
T3653,Vel exercitationem animi nemo laborum totam repudiandae ab,WISH,Joe,15,TODO
T3654,Animi nam veniam suscipit doloribus ipsam,COULD,Joe,1,DONE
T3655,Placeat officia voluptate nisi qui corporis,SHOULD,Natasha,15,TODO
T3656,Voluptatibus quam explicabo suscipit labore reprehenderit,SHOULD,Joe,2,DOING
T3657,Cum maxime sint,WISH,Joe,2,DONE
T3658,Adipisci eligendi,WISH,Mike,1,DONE
T3659,Illo quod facilis,WISH,Joe,7,DONE
T3660,Odio harum,COULD,Mike,10,TODO
T3661,Ratione esse eligendi deserunt,MUST,Natasha,10,DONE
T3662,Est similique laudantium vitae,WISH,Natasha,10,DONE
T3663,Necessitatibus sunt molestias,SHOULD,Joe,10,DONE
T3664,Ducimus officiis ad maxime nobis possimus quia,SHOULD,Mike,2,DONE
T3665,Aliquam dolorum laborum minus,COULD,Natasha,10,DOING
T3666,Culpa similique corporis,WISH,Joe,2,TODO
T3667,Earum incidunt odio et harum id nisi,WISH,Joe,2,DONE
T3668,Veritatis modi inventore dolorum est eius doloribus,COULD,Joe,1,DONE
T3669,Officiis temporibus iusto sapiente debitis iusto,COULD,Natasha,2,DONE
T3670,Quos officia consequuntur omnis animi dolor commodi earum eligendi,COULD,Mike,2,DONE
T3671,Dolorum ullam velit,SHOULD,Joe,10,DONE
T3672,Tempora ullam non quis neque doloribus,WISH,Natasha,15,TODO
T3673,Repudiandae cupiditate doloribus debitis nemo omnis dolor minus,COULD,Mike,1,DONE
T3674,Labore nesciunt rem sed,SHOULD,Joe,15,DONE
T3675,Molestiae et dignissimos veritatis,SHOULD,Joe,1,DONE
T3676,Aperiam totam placeat officiis dolores reprehenderit praesentium cupiditate,COULD,Joe,15,DONE
T3677,Iste delectus architecto natus accusantium qui,WISH,Joe,15,DONE
T3678,Accusamus nihil optio omnis,MUST,Joe,2,DONE
T3679,Similique repellendus rerum aspernatur asperiores consequatur iure rem,COULD,Natasha,2,TODO
T3680,Quo laboriosam,COULD,Joe,10,DONE
T3681,Tempore nobis tenetur possimus,WISH,Joe,1,DONE
T3682,Omnis doloribus repellendus quibusdam doloremque ipsa harum expedita,WISH,Natasha,2,DONE
T3683,Nostrum quos sunt,COULD,Natasha,7,DONE
T3684,Reprehenderit ipsum,WISH,Joe,10,TODO
T3685,Nostrum deleniti debitis eligendi inventore a harum quasi magni,SHOULD,Joe,15,DONE
T3686,Voluptatum necessitatibus voluptate tempora,COULD,Joe,2,DONE
T3687,Dolore totam quam doloribus,COULD,Joe,2,TODO
T3688,Quae quasi,WISH,Natasha,10,DONE
T3689,Sed fuga quos,COULD,Joe,2,TODO
T3690,Molestiae pariatur consequatur adipisci,SHOULD,Joe,1,DONE
T3691,Quod cumque aut odio eum,COULD,Joe,1,DONE
T3692,Nam itaque repellendus,WISH,Joe,2,DONE
T3693,Alias hic accusantium explicabo temporibus perspiciatis,WISH,Joe,1,DONE
T3694,Consectetur ex corporis,WISH,Joe,10,DONE
T3695,Iure neque ipsam officiis delectus vitae architecto consequatur consequatur,SHOULD,Mike,1,DONE
T3696,Laudantium aut,SHOULD,Natasha,2,TODO
T3697,Provident pariatur necessitatibus quia magnam sequi,SHOULD,Mike,1,DONE
T3698,Ex tempore asperiores illo aliquid,COULD,Natasha,10,DONE
T3699,Impedit magni unde mollitia,WISH,Natasha,2,DOING
T3700,At reiciendis culpa neque nulla aut nemo,COULD,Joe,10,DONE
T3701,Optio officiis praesentium,SHOULD,Mike,2,DONE
T3702,Quis ipsum distinctio odio blanditiis sit,COULD,Mike,1,DONE
T3703,Eveniet temporibus fuga sequi,SHOULD,Mike,15,DONE
T3704,Sed quod explicabo repellendus nisi,WISH,Joe,10,TODO
T3705,Illo itaque cumque sint vero dolore nesciunt adipisci,SHOULD,Joe,7,TODO
T3706,Libero blanditiis,WISH,Natasha,2,DOING
T3707,Architecto tempora explicabo,SHOULD,Natasha,10,DONE
T3708,Nobis nesciunt cum minus quaerat facilis animi,SHOULD,Joe,1,DOING
T3709,Eos voluptatibus commodi distinctio excepturi iste quia fugit labore,COULD,Joe,2,DONE
T3710,Cumque ad harum,MUST,Mike,10,DONE
T3711,A voluptatibus,COULD,Joe,7,TODO
T3712,Voluptate provident quam tenetur,SHOULD,Natasha,10,TODO
T3713,Repudiandae quam magnam officiis minus in placeat at voluptas tenetur beatae,SHOULD,Natasha,1,DONE
T3714,Non molestiae aspernatur,MUST,Joe,15,DONE
T3715,Doloremque voluptatum reprehenderit neque corporis deleniti necessitatibus,MUST,Joe,2,DONE
T3716,Asperiores eveniet ratione minus labore necessitatibus sequi nam,COULD,Mike,10,DONE
T3717,Quas ex voluptas similique accusamus libero,SHOULD,Mike,10,TODO
T3718,Ad asperiores a fugiat tenetur sunt ad quaerat quidem tempore,WISH,Joe,1,DONE
T3719,Officiis error architecto facere laudantium soluta assumenda,WISH,Mike,4,DONE
T3720,Deserunt occaecati optio,SHOULD,Joe,15,DONE
T3721,Laudantium rem illo odit natus facilis,COULD,Joe,15,DONE
T3722,Laboriosam,COULD,Mike,1,TODO
T3723,Expedita dolorum deserunt repellat eligendi velit,COULD,Mike,7,DONE
T3724,Totam quae labore id,COULD,Joe,15,DONE
T3725,Dolorum nam blanditiis,MUST,Joe,10,DOING
T3726,Doloremque itaque explicabo,WISH,Joe,15,DONE
T3727,Ipsa animi tenetur incidunt,MUST,Natasha,15,DONE
T3728,Illum quos ex rem at,COULD,Joe,4,DONE
T3729,Deleniti debitis error distinctio itaque facilis,SHOULD,Mike,15,DONE
T3730,Debitis itaque ea fugit cum molestias officiis dolore,SHOULD,Joe,15,TODO
T3731,Fugiat ipsa omnis distinctio dicta,SHOULD,Mike,1,DONE
T3732,Fuga minima quae reiciendis,COULD,Joe,10,DONE
T3733,Nisi doloribus minima explicabo maiores quae saepe,WISH,Natasha,7,TODO
T3734,Iusto consectetur vitae eum tempora sequi,COULD,Joe,7,DONE
T3735,Corrupti eveniet omnis iusto exercitationem accusantium,SHOULD,Joe,2,DONE
T3736,Repellendus at beatae aspernatur nihil veritatis explicabo possimus,COULD,Joe,2,DONE
T3737,Ipsa et quas molestias expedita perspiciatis magni,SHOULD,Natasha,10,DONE
T3738,Cumque accusantium et reiciendis iste consequatur ipsa tempore vel nostrum,WISH,Joe,7,DONE
T3739,Mollitia quam id corrupti voluptates autem,WISH,Mike,10,DONE
T3740,Perferendis distinctio nostrum aspernatur reiciendis sequi delectus esse,SHOULD,Natasha,1,DONE
T3741,Voluptatem eaque,WISH,Natasha,10,DONE
T3742,Sed totam cumque atque facilis impedit,COULD,Mike,2,DONE
T3743,Accusamus expedita explicabo corrupti necessitatibus dicta ipsa dolore,SHOULD,Mike,2,DONE
T3744,Repellendus vitae similique quidem illo vitae eius iste,COULD,Mike,15,TODO
T3745,Numquam aliquid est illum iusto temporibus,SHOULD,Mike,2,TODO
T3746,Eveniet unde adipisci vel similique,COULD,Joe,1,DONE
T3747,Ullam odio libero placeat vel esse maxime alias similique in,COULD,Mike,1,DOING
T3748,Repudiandae laborum nam repellat,COULD,Joe,1,TODO
T3749,Cumque optio officiis fugit adipisci minus officia,COULD,Joe,3,DONE
T3750,Nostrum doloribus natus dolorem,MUST,Natasha,7,DONE
T3751,Fuga doloremque nulla repellat suscipit,WISH,Joe,10,DONE
T3752,At placeat dolorum,COULD,Joe,15,DONE
T3753,Cupiditate blanditiis veritatis aspernatur vero nobis eveniet,SHOULD,Natasha,2,DONE
T3754,Repudiandae magnam beatae,WISH,Mike,2,DOING
T3755,Laborum rerum sint aspernatur eveniet pariatur dolorum laudantium,SHOULD,Mike,1,DONE
T3756,Autem incidunt ipsam,SHOULD,Joe,2,DOING
T3757,Vel perferendis quos voluptatum,WISH,Mike,1,DONE
T3758,Saepe harum modi accusamus iste tempore,COULD,Mike,10,DONE
T3759,Quasi temporibus minima dolorem ducimus fuga suscipit,COULD,Natasha,10,DOING
T3760,Sapiente praesentium,COULD,Joe,7,TODO
T3761,Nostrum voluptate,WISH,Mike,15,DONE
T3762,Distinctio eaque ea eum,WISH,Natasha,10,DOING
T3763,Nobis distinctio ut quas libero unde eligendi architecto non dolore,COULD,Joe,10,DONE
T3764,Quae laudantium quaerat,WISH,Natasha,7,DONE
T3765,Laudantium officiis sapiente aspernatur provident,WISH,Mike,2,DONE
T3766,Autem odit delectus,COULD,Joe,1,DONE
T3767,Tenetur nam delectus,MUST,Natasha,1,DONE
T3768,Tempore cum,WISH,Natasha,10,DOING
T3769,Temporibus quis dolor nobis adipisci iste,WISH,Natasha,15,DONE
T3770,Maiores placeat eos,COULD,Mike,2,DONE
T3771,Harum doloribus soluta ullam cupiditate soluta,COULD,Mike,10,DONE
T3772,Dolorem dolore sit accusamus esse nemo praesentium ipsum impedit voluptatem,COULD,Joe,15,DONE
T3773,Fuga dolor et alias eius natus occaecati eveniet,WISH,Mike,1,DONE
T3774,Accusantium adipisci quibusdam vero ipsam in,COULD,Natasha,2,DONE
T3775,Sunt alias repudiandae saepe asperiores sapiente,SHOULD,Joe,10,DONE
T3776,Assumenda veniam hic quo aspernatur,MUST,Mike,10,DONE
T3777,Tempore est,WISH,Natasha,4,TODO
T3778,Molestias,COULD,Mike,10,TODO
T3779,Vel doloremque velit atque tempora error,WISH,Natasha,1,DONE
T3780,Sed a sequi,WISH,Natasha,15,DONE
T3781,Earum aperiam minima architecto,WISH,Natasha,10,TODO
T3782,Mollitia laboriosam non deleniti,WISH,Joe,15,TODO
T3783,Velit excepturi temporibus,WISH,Joe,10,DONE
T3784,Saepe atque vero similique molestias,COULD,Joe,7,DONE
T3785,Molestias perferendis quas officia,SHOULD,Joe,2,DONE
T3786,Perspiciatis sed quisquam sint dolores quae,COULD,Natasha,2,DONE
T3787,Est velit quidem omnis corporis,COULD,Joe,7,TODO
T3788,Quasi nihil,WISH,Mike,2,DONE
T3789,Laboriosam temporibus non architecto nam molestiae accusantium,WISH,Mike,1,DOING
T3790,Facere veniam veritatis consequatur quaerat ab,WISH,Joe,15,DONE
T3791,Modi molestias similique temporibus deleniti consequuntur deleniti minima,SHOULD,Natasha,1,DOING
T3792,Est aliquam eum,WISH,Mike,10,DONE
T3793,Recusandae corrupti minus excepturi nisi,WISH,Natasha,1,DONE
T3794,Nesciunt blanditiis corporis voluptate,COULD,Natasha,7,TODO
T3795,Tenetur autem corrupti architecto possimus,SHOULD,Joe,10,DONE
T3796,Perspiciatis corrupti eos nisi quasi,COULD,Joe,10,DONE
T3797,Consequatur temporibus delectus commodi totam voluptatem ea repellat,WISH,Joe,1,DONE
T3798,Adipisci cum in blanditiis impedit voluptatibus,SHOULD,Joe,1,DONE
T3799,Cupiditate aperiam ipsam,COULD,Joe,15,DONE
T3800,Optio temporibus laborum dolorum nihil suscipit illo,COULD,Joe,1,DONE
T3801,Consequatur ullam quam fugiat in iusto aperiam,SHOULD,Joe,10,DONE
T3802,Quae est officiis ex beatae,WISH,Joe,15,DONE
T3803,Tempore molestias debitis minus maxime inventore,SHOULD,Natasha,10,DONE
T3804,Magni cupiditate amet tempora veritatis,COULD,Joe,2,DONE
T3805,Itaque ea earum expedita occaecati,SHOULD,Joe,15,DOING
T3806,Quidem odit,SHOULD,Natasha,2,DONE
T3807,Odio magni ipsam,SHOULD,Mike,15,DONE
T3808,Ratione vel dolores ad,COULD,Natasha,15,DONE
T3809,Ea fugit sapiente ducimus,COULD,Joe,2,DONE
T3810,Animi deleniti eos voluptate,WISH,Natasha,1,DONE
T3811,Iure qui nam,COULD,Natasha,1,DONE
T3812,Nulla libero,SHOULD,Joe,10,DONE
T3813,Magnam doloribus eius unde reprehenderit,WISH,Mike,7,TODO
T3814,Soluta sint fugit,COULD,Joe,15,DONE
T3815,Id animi dignissimos eligendi tempore,COULD,Mike,1,DONE
T3816,Reiciendis quod,COULD,Natasha,10,DONE
T3817,Veniam tempore perferendis assumenda,SHOULD,Joe,1,DONE
T3818,Libero neque unde,SHOULD,Joe,7,DONE
T3819,Eum libero suscipit harum,COULD,Natasha,15,DOING
T3820,Corporis labore cupiditate odit aliquam quis,MUST,Natasha,7,DONE
T3821,Blanditiis repellendus neque maxime cupiditate esse vel,COULD,Mike,10,DONE
T3822,Laudantium nam magni velit placeat numquam aspernatur,COULD,Natasha,1,DONE
T3823,Omnis cupiditate molestias voluptas at hic excepturi ex,COULD,Natasha,15,DONE
T3824,Iure eligendi eaque,COULD,Mike,4,DONE
T3825,Est adipisci ad tempora,WISH,Natasha,15,DONE
T3826,Nobis delectus quisquam inventore impedit vero,COULD,Joe,2,DOING
T3827,Deleniti nobis perspiciatis,COULD,Joe,15,DOING
T3828,Fuga rem eos,WISH,Joe,10,DONE
T3829,Debitis et reiciendis consequatur maxime eius ratione expedita porro quia,COULD,Joe,15,DONE
T3830,Quidem magni quasi totam ducimus,COULD,Mike,15,TODO
T3831,Tempore qui molestias aut dolores dolore amet,MUST,Joe,15,DOING
T3832,Doloribus neque quas voluptatem,COULD,Mike,10,DONE
T3833,Qui corrupti accusamus tempora,MUST,Natasha,10,TODO
T3834,Quaerat,COULD,Joe,1,DONE
T3835,Facilis aperiam adipisci vel porro,COULD,Joe,2,DONE
T3836,Recusandae sed officiis fuga,WISH,Joe,1,DONE
T3837,Tempore quas doloribus doloremque veniam eveniet cum exercitationem at,COULD,Joe,2,DONE
T3838,Quasi nisi laudantium,WISH,Joe,2,DONE
T3839,At totam labore veritatis,WISH,Natasha,1,DONE
T3840,Deleniti aliquam impedit,COULD,Natasha,10,TODO
T3841,At error,COULD,Joe,10,DONE
T3842,Ipsa eius eveniet,SHOULD,Natasha,10,TODO
T3843,Similique nesciunt at,MUST,Joe,10,DONE
T3844,Tempora quibusdam cum,WISH,Natasha,7,DONE
T3845,Pariatur animi distinctio non,WISH,Joe,15,TODO
T3846,Ipsam tempora dignissimos repudiandae,WISH,Joe,1,DONE
T3847,Repellendus ratione sapiente ad reprehenderit sunt id,WISH,Mike,10,DONE
T3848,Suscipit repellat illum nisi cumque vitae,WISH,Natasha,2,DONE
T3849,Fugit at laudantium alias vitae facere iste nisi,COULD,Joe,7,DONE
T3850,Eligendi mollitia officia ad,WISH,Joe,2,TODO
T3851,Quia voluptas exercitationem veritatis,SHOULD,Joe,10,DONE
T3852,Tenetur illum corporis laborum vitae placeat aliquam,COULD,Mike,1,DONE
T3853,Architecto aspernatur distinctio nulla sit,WISH,Joe,10,DONE
T3854,Atque perferendis distinctio repudiandae,WISH,Joe,10,DONE
T3855,Nesciunt et fugiat voluptatem libero pariatur,WISH,Mike,10,DONE
T3856,Sapiente odio,COULD,Joe,10,DOING
T3857,Harum quis,MUST,Natasha,1,DONE
T3858,Itaque illum a maxime cum possimus iusto itaque earum autem,MUST,Joe,7,DONE
T3859,Laboriosam eius doloribus dolore pariatur totam,COULD,Joe,10,TODO
T3860,Laudantium perferendis rem sed facere corrupti blanditiis,WISH,Mike,7,DONE
T3861,Minus nam eius ipsa expedita voluptatem,COULD,Natasha,15,DONE
T3862,Neque sequi velit reiciendis nemo,SHOULD,Joe,2,DONE
T3863,Soluta nesciunt natus praesentium beatae ex veniam quaerat repellat,COULD,Mike,2,DONE
T3864,Ducimus cum magnam ipsum modi,COULD,Joe,10,DONE
T3865,Fuga facilis veritatis esse,COULD,Mike,10,TODO
T3866,Accusantium nemo doloremque cumque aperiam,COULD,Natasha,1,DONE
T3867,Minima eum vel molestiae,WISH,Joe,10,DONE
T3868,Est velit ullam,SHOULD,Joe,7,DONE
T3869,In quae voluptatem inventore,COULD,Natasha,1,DONE
T3870,Accusantium temporibus maxime,MUST,Natasha,10,DONE
T3871,Aspernatur rerum labore commodi totam error culpa maxime iste,COULD,Joe,1,DONE
T3872,Ratione possimus possimus quas quos,WISH,Mike,10,DONE
T3873,Nobis doloribus vitae dignissimos,WISH,Natasha,10,DONE
T3874,Nemo numquam,WISH,Mike,10,DONE
T3875,Qui dolore asperiores pariatur,SHOULD,Joe,1,DOING
T3876,Non nemo laborum accusantium voluptatem ea non rerum assumenda,MUST,Joe,10,DONE
T3877,Dolor nesciunt tempore ad at,MUST,Mike,15,DONE
T3878,Exercitationem porro ipsam ut,SHOULD,Mike,10,DONE
T3879,Possimus adipisci,WISH,Joe,1,DONE
T3880,In exercitationem sequi similique voluptate quae,SHOULD,Joe,4,DONE
T3881,Inventore temporibus,WISH,Joe,10,TODO
T3882,Doloribus rem voluptates eum quae asperiores,COULD,Joe,2,DONE
T3883,Pariatur perferendis,SHOULD,Joe,2,DONE
T3884,Minus labore ipsa necessitatibus earum dolores totam laboriosam,SHOULD,Joe,10,DONE
T3885,Optio et,COULD,Joe,10,DONE
T3886,Repudiandae laboriosam harum nostrum necessitatibus laboriosam maxime,WISH,Joe,1,DONE
T3887,Quam consequatur aperiam rem numquam,WISH,Joe,7,DOING
T3888,Itaque quam dicta illum corrupti,WISH,Natasha,1,DONE
T3889,Fugiat ratione facilis tempore,COULD,Natasha,10,DONE
T3890,Quos eius error aut nam,SHOULD,Joe,1,TODO
T3891,Omnis qui quaerat aspernatur nesciunt illum,WISH,Mike,10,DOING
T3892,Dignissimos autem odit assumenda beatae ipsa,WISH,Joe,2,TODO
T3893,Corrupti ratione et voluptatum recusandae voluptatibus harum quidem quisquam pariatur,SHOULD,Mike,2,TODO
T3894,Iure minus sed dolore in saepe minus iste,COULD,Joe,3,DONE
T3895,Dicta,WISH,Mike,1,DONE
T3896,Esse neque alias dignissimos laudantium dolores est eveniet,COULD,Mike,2,DONE
T3897,Reiciendis mollitia vel tempora,COULD,Joe,10,DONE
T3898,Officia vero ab magnam,COULD,Joe,10,DONE
T3899,Aperiam corporis,SHOULD,Mike,10,TODO
T3900,Maxime explicabo,WISH,Mike,15,DONE
T3901,Praesentium doloremque vel tempore recusandae,COULD,Natasha,10,DONE
T3902,Consequatur,COULD,Joe,10,DONE
T3903,Adipisci amet aperiam sunt fugit,COULD,Joe,10,DONE
T3904,Ratione natus laborum alias assumenda aliquam asperiores,COULD,Joe,10,DONE
T3905,A temporibus odio voluptas modi ea,WISH,Joe,1,DONE
T3906,Porro omnis corrupti quas exercitationem cupiditate perferendis aspernatur,WISH,Mike,15,DONE
T3907,Distinctio perspiciatis deleniti cupiditate,SHOULD,Natasha,1,DONE
T3908,Ut amet alias at repellendus non,WISH,Mike,10,DONE
T3909,Sapiente quibusdam tenetur nam nihil,WISH,Natasha,10,DONE
T3910,Delectus alias quas deleniti magni,SHOULD,Joe,10,TODO
T3911,Debitis possimus sunt earum ipsam veritatis,WISH,Joe,15,DONE
T3912,Atque ipsum voluptatem doloremque enim quam,COULD,Mike,1,DONE
T3913,Est eligendi totam soluta voluptatibus veniam illum sit,COULD,Joe,10,DONE
T3914,Incidunt doloremque molestiae,SHOULD,Joe,1,DONE
T3915,Commodi nam excepturi,COULD,Joe,2,TODO
T3916,Dolorum tempora officia nisi,WISH,Joe,10,TODO
T3917,Delectus sit dolore assumenda cumque atque expedita,COULD,Joe,1,DONE
T3918,Nostrum autem commodi,WISH,Natasha,1,DONE
T3919,Explicabo aliquid blanditiis perferendis laboriosam laboriosam,WISH,Joe,10,DONE
T3920,Praesentium dolore,WISH,Natasha,2,DONE
T3921,Saepe at,COULD,Mike,2,DONE
T3922,Iure commodi quam impedit iste,SHOULD,Joe,10,TODO
T3923,Repellat enim rerum iste hic,WISH,Mike,1,TODO
T3924,Tenetur atque fugiat eaque voluptates maiores quidem accusantium,SHOULD,Mike,10,DONE
T3925,Unde qui reiciendis quasi consequuntur animi,MUST,Joe,2,DONE
T3926,Ducimus blanditiis voluptas fugit a quae nisi vero,COULD,Natasha,10,DONE
T3927,Beatae vitae excepturi,WISH,Natasha,10,TODO
T3928,Libero ullam eveniet maxime illo corporis fugit modi,WISH,Joe,10,TODO
T3929,Aut sed porro placeat nemo fugit,WISH,Mike,1,DONE
T3930,Tempora quo corrupti mollitia occaecati doloremque tempore ex,SHOULD,Joe,2,DONE
T3931,Labore maxime atque unde vitae,COULD,Joe,2,DONE
T3932,Ullam molestiae placeat odio,WISH,Joe,1,DONE
T3933,Rerum officia saepe optio ad nobis provident hic corporis iusto commodi,COULD,Natasha,7,TODO
T3934,Rem omnis labore,COULD,Natasha,10,DONE
