id,name,priority,who,time,status
T8124,Commodi soluta officia fuga iure deleniti aliquid,SHOULD,Natasha,7,TODO
T8125,Temporibus saepe,COULD,Joe,1,DONE
T8126,Veritatis nam veritatis inventore debitis quod,SHOULD,Mike,10,DONE
T8127,Repellendus delectus mollitia expedita unde,WISH,Joe,10,DONE
T8128,Odit amet ratione atque sit aspernatur,COULD,Joe,15,DOING
T8129,Explicabo qui sint repellat alias mollitia suscipit,COULD,Mike,10,DOING
T8130,Voluptatum quisquam molestiae,WISH,Joe,10,TODO
T8131,Temporibus deleniti beatae,SHOULD,Joe,7,DONE
T8132,Mollitia necessitatibus,WISH,Joe,15,DONE
T8133,Repudiandae nemo mollitia corrupti,WISH,Joe,2,DONE
T8134,Ratione,COULD,Joe,10,DONE
T8135,Dolorem ex beatae at,MUST,Joe,15,DOING
T8136,Magnam labore soluta laborum architecto reprehenderit sit inventore,WISH,Joe,1,DONE
T8137,Veniam sint reiciendis consequuntur cupiditate,COULD,Natasha,15,DOING
T8138,Veniam delectus possimus magni molestiae,MUST,Natasha,4,DONE
T8139,Voluptatem molestiae ad dignissimos praesentium,WISH,Natasha,1,DONE
T8140,Accusamus harum laborum animi vitae nisi,COULD,Natasha,7,DONE
T8141,Nam minima impedit,SHOULD,Natasha,1,DONE
T8142,Qui deleniti eius neque quo modi,WISH,Natasha,7,DONE
T8143,Reiciendis quisquam inventore,COULD,Joe,15,DONE
T8144,Pariatur illo iste facere,WISH,Natasha,15,DOING
T8145,Blanditiis corrupti quis similique,COULD,Natasha,15,DONE
T8146,Doloribus nemo laudantium reprehenderit,MUST,Natasha,10,DONE
T8147,Laborum ea distinctio consequuntur accusamus sunt,MUST,Joe,7,TODO
T8148,Eligendi autem,COULD,Mike,15,DOING
T8149,Blanditiis consectetur atque consequuntur ratione,COULD,Natasha,7,TODO
T8150,Nesciunt voluptatum et dolores soluta voluptate corrupti sint odio,COULD,Joe,15,DONE
T8151,Inventore ducimus dicta officiis qui,SHOULD,Joe,1,DONE
T8152,Veritatis laudantium tempora neque,COULD,Joe,1,DONE
T8153,Eum aliquam excepturi blanditiis delectus consectetur,WISH,Joe,2,DONE
T8154,Corporis,COULD,Natasha,1,DONE
T8155,Ea sint consequuntur similique,COULD,Joe,2,DONE
T8156,Quam magnam eaque,COULD,Joe,2,TODO
T8157,Provident occaecati qui,MUST,Joe,7,DONE
T8158,Autem aliquid blanditiis dolores laborum,SHOULD,Joe,1,TODO
T8159,Molestiae facere commodi eum,WISH,Joe,1,DOING
T8160,Nostrum modi vero inventore consectetur veritatis quae,WISH,Natasha,10,DOING
T8161,Iusto voluptatum iusto delectus fugiat quis pariatur,WISH,Natasha,15,DONE
T8162,Dicta repellat eius,COULD,Natasha,10,DONE
T8163,Quod aperiam aperiam,WISH,Joe,2,DONE
T8164,Quia quia eveniet odio incidunt,WISH,Natasha,10,DONE
T8165,Temporibus,SHOULD,Mike,2,TODO
T8166,Repellendus non laboriosam,COULD,Natasha,15,DONE
T8167,Sapiente voluptatibus distinctio,COULD,Joe,7,TODO
T8168,Blanditiis illo quae debitis,COULD,Joe,1,DONE
T8169,Sed dolores incidunt vitae repellendus,WISH,Joe,2,DONE
T8170,Assumenda ex quisquam quisquam minus velit magnam,SHOULD,Joe,10,TODO
T8171,Accusantium cumque rerum nesciunt quia ad,COULD,Joe,10,DOING
T8172,Facilis saepe quia id quo beatae quam minus,MUST,Natasha,10,TODO
T8173,Itaque quasi quo error ipsa consequatur saepe nostrum adipisci,COULD,Joe,15,DONE
T8174,Nihil tempora quasi neque voluptates sequi blanditiis aut temporibus,MUST,Joe,2,DONE
T8175,Nobis dolorem at debitis atque doloremque eum,WISH,Joe,10,DONE
T8176,Culpa qui pariatur labore quam nostrum quibusdam,MUST,Natasha,2,DONE
T8177,Laboriosam dolorem nesciunt illum ea tempora,MUST,Natasha,1,DONE
T8178,Nihil quaerat maxime,SHOULD,Natasha,7,DONE
T8179,Necessitatibus,WISH,Joe,15,DOING
T8180,Saepe fugiat,WISH,Natasha,7,DONE
T8181,Voluptatibus molestiae,COULD,Joe,2,DONE
T8182,Ea voluptate hic accusamus amet unde adipisci,COULD,Joe,15,DONE
T8183,Dolorum quisquam dicta,WISH,Mike,10,DONE
T8184,Adipisci quibusdam temporibus,COULD,Joe,2,TODO
T8185,Ad laborum natus officiis tempora,SHOULD,Joe,1,DONE
T8186,Architecto dolorem doloribus repellat quidem quisquam blanditiis distinctio,COULD,Natasha,7,TODO
T8187,Explicabo eveniet iusto aliquid animi magni aspernatur officia odio,WISH,Natasha,15,DONE
T8188,Quas necessitatibus nostrum debitis placeat quos laborum,WISH,Joe,10,DONE
T8189,Fuga numquam excepturi vel molestias eveniet ullam vel temporibus,WISH,Natasha,15,DONE
T8190,Doloribus laborum molestiae modi placeat,WISH,Natasha,1,TODO
T8191,Fugiat natus qui omnis magni optio explicabo cumque quam,WISH,Mike,2,TODO
T8192,Consectetur ea,SHOULD,Joe,15,DOING
T8193,Ad iusto assumenda,COULD,Natasha,15,DONE
T8194,Unde magnam molestiae dolore recusandae,COULD,Natasha,2,DONE
T8195,Recusandae ex,SHOULD,Mike,10,DONE
T8196,Officiis temporibus dolore impedit neque iusto,WISH,Joe,7,DONE
T8197,Facilis iusto,COULD,Natasha,10,TODO
T8198,Adipisci ad hic temporibus culpa consectetur,COULD,Natasha,10,DONE
T8199,Delectus ipsa illo natus,COULD,Joe,1,TODO
T8200,Voluptatem recusandae incidunt tempore nisi,COULD,Joe,1,DOING
T8201,Velit itaque et itaque,MUST,Joe,10,DONE
T8202,Quaerat ullam,WISH,Natasha,10,DONE
T8203,Animi esse,SHOULD,Joe,10,DOING
T8204,Autem ipsa veniam provident autem earum eius magni asperiores,WISH,Joe,10,DONE
T8205,Delectus ab eveniet dolore,COULD,Joe,1,DONE
T8206,Libero cum totam nulla vel,SHOULD,Joe,10,DONE
T8207,Natus vero sint ab,COULD,Joe,1,DONE
T8208,Expedita voluptate ea,COULD,Natasha,1,DONE
T8209,Doloribus perspiciatis dolor,COULD,Natasha,7,DONE
T8210,Molestiae consequuntur quaerat dolorum,SHOULD,Natasha,10,DOING
T8211,Et voluptas velit,WISH,Mike,2,DONE
T8212,Fugit porro quasi,SHOULD,Joe,10,DONE
T8213,Porro at quam blanditiis nisi sint,COULD,Joe,2,DONE
T8214,Debitis asperiores architecto labore corporis fuga itaque delectus quae,WISH,Natasha,1,DONE
T8215,Illum reiciendis accusantium,COULD,Natasha,2,DONE
T8216,Sapiente amet temporibus ullam molestias iste explicabo iste sint laudantium sapiente,WISH,Joe,1,DONE
T8217,Unde quas aspernatur ipsa sapiente incidunt quos,COULD,Joe,15,DONE
T8218,Odio alias nihil,WISH,Natasha,7,DOING
T8219,Ratione nobis tenetur praesentium nam,MUST,Natasha,1,DONE
T8220,Occaecati veniam totam,COULD,Joe,2,DONE
T8221,Aut amet tempora perspiciatis veniam,WISH,Joe,10,DONE
T8222,Porro voluptatem perferendis repellendus accusantium maxime assumenda,COULD,Joe,15,DONE
T8223,Alias aliquam reprehenderit impedit eaque vitae minus non ratione,SHOULD,Natasha,2,DONE
T8224,Vitae rerum dolores assumenda voluptas,SHOULD,Natasha,10,DONE
T8225,Possimus maxime laboriosam excepturi magni explicabo a fugiat neque,MUST,Joe,10,DONE
T8226,Omnis quasi,WISH,Joe,10,DONE
T8227,Incidunt nam velit quis consequuntur,SHOULD,Mike,7,DONE
T8228,Quod facere officiis maxime praesentium,SHOULD,Mike,2,DONE
T8229,Consequatur doloremque animi nam veniam saepe officiis,SHOULD,Natasha,15,DONE
T8230,Error nobis accusamus quisquam vel,SHOULD,Natasha,10,DONE
T8231,Voluptates dicta quidem expedita eum,COULD,Natasha,1,TODO
T8232,Rerum ullam autem similique rem beatae,WISH,Natasha,15,DOING
T8233,Ab eius,SHOULD,Natasha,1,DONE
T8234,Error odit pariatur architecto occaecati error dicta quos hic,WISH,Joe,10,DOING
T8235,Quo officiis dolor reiciendis a quidem architecto nulla,COULD,Joe,1,DONE
T8236,Harum deleniti veritatis doloribus,COULD,Mike,10,DOING
T8237,Nisi deserunt inventore in earum rem,SHOULD,Joe,15,DONE
T8238,Asperiores excepturi laboriosam molestias,SHOULD,Joe,10,DONE
T8239,Sequi possimus,COULD,Joe,7,DONE
T8240,Provident repudiandae quia qui exercitationem laboriosam cum occaecati sunt,WISH,Mike,1,DONE
T8241,Eaque excepturi exercitationem in ipsam,COULD,Mike,10,DONE
T8242,Facere totam cumque quia soluta officia,SHOULD,Joe,15,DONE
T8243,Magni occaecati ipsum officia tempore quibusdam maiores,COULD,Mike,10,DONE
T8244,Beatae suscipit deleniti voluptatum consequatur optio,SHOULD,Natasha,1,DONE
T8245,Amet non perferendis,COULD,Natasha,1,DONE
T8246,Fuga dolorem dolorem est expedita dolorum architecto culpa,COULD,Joe,7,DONE
T8247,Nobis recusandae aspernatur harum dicta voluptate,SHOULD,Joe,10,DONE
T8248,Sapiente repellendus vel,SHOULD,Natasha,10,DONE
T8249,Dolores facilis ut dolorum sapiente temporibus aliquam,WISH,Mike,1,DONE
T8250,Error totam atque,COULD,Joe,15,DONE
T8251,Sunt distinctio recusandae cumque et inventore,COULD,Mike,1,DONE
T8252,Animi magnam omnis enim perferendis tenetur,WISH,Mike,1,DONE
T8253,Dolore suscipit illum,WISH,Joe,7,TODO
T8254,Tenetur ipsum culpa,SHOULD,Mike,15,TODO
T8255,A animi illum voluptatem,WISH,Joe,2,DONE
T8256,Hic harum quod praesentium dolore,COULD,Natasha,7,DONE
T8257,Labore consequuntur cum vel quaerat dolor,MUST,Mike,10,DONE
T8258,Nobis facilis debitis et amet voluptatum numquam,WISH,Natasha,15,TODO
T8259,Praesentium eveniet veritatis quo illum error,SHOULD,Joe,1,DONE
T8260,Distinctio eum,MUST,Joe,10,TODO
T8261,Fugiat excepturi inventore quibusdam modi facere laboriosam odio occaecati quo,WISH,Joe,1,DONE
T8262,Reiciendis quibusdam dolorem explicabo nesciunt dolor,SHOULD,Natasha,10,TODO
T8263,Fugiat iure suscipit officia animi nisi molestias,COULD,Mike,2,DONE
T8264,Accusamus illum similique officia in,WISH,Joe,1,TODO
T8265,Praesentium explicabo adipisci aliquam officia ab harum,COULD,Joe,1,DONE
T8266,Doloremque saepe vitae at,WISH,Joe,2,DONE
T8267,Ipsum magnam,MUST,Joe,1,TODO
T8268,Veniam quo totam tempora qui saepe quos debitis nesciunt veniam aliquid,SHOULD,Mike,10,DONE
T8269,Quae atque dolor eaque,COULD,Mike,15,DONE
T8270,Dolorum voluptatum,MUST,Natasha,10,TODO
T8271,Quaerat itaque ducimus recusandae fuga,WISH,Joe,10,DONE
T8272,Magni corrupti magni distinctio,WISH,Natasha,2,TODO
T8273,Odit laboriosam at occaecati animi suscipit saepe aliquid quas maxime temporibus,COULD,Natasha,3,TODO
T8274,Error veniam exercitationem minima a,COULD,Natasha,1,TODO
T8275,Doloribus et iure,WISH,Joe,15,DONE
T8276,Deserunt explicabo officiis,SHOULD,Joe,10,TODO
T8277,Itaque id ratione,COULD,Natasha,10,DONE
T8278,Necessitatibus vel provident ullam,COULD,Mike,4,DONE
T8279,Beatae iste maiores quod laborum inventore explicabo unde,SHOULD,Joe,10,DONE
T8280,Perspiciatis laborum,SHOULD,Joe,15,DONE
T8281,Ratione quam cupiditate ratione,SHOULD,Mike,10,DONE
T8282,Dolore eveniet tenetur,COULD,Mike,10,DONE
T8283,Molestias dolorum repudiandae,COULD,Mike,15,DONE
T8284,Laudantium ducimus,COULD,Natasha,1,DONE
T8285,Odit ab consequuntur iusto eos sint facilis ut modi,SHOULD,Joe,1,DONE
T8286,Quasi,COULD,Natasha,10,DOING
T8287,Ullam amet error animi at,SHOULD,Mike,15,DONE
T8288,Hic earum saepe soluta dicta quibusdam,WISH,Mike,1,DONE
T8289,Odio amet velit asperiores quidem repudiandae facere molestiae illo,COULD,Joe,7,TODO
T8290,Esse,COULD,Natasha,10,DONE
T8291,Minima debitis reprehenderit facere aliquid,SHOULD,Natasha,2,DONE
T8292,Praesentium aspernatur recusandae,WISH,Natasha,2,DONE
T8293,Vitae commodi asperiores suscipit ipsam architecto minus doloremque,WISH,Joe,10,DOING
T8294,Nobis quasi eaque dolorum incidunt,WISH,Mike,1,DOING
T8295,Repudiandae rem repellendus voluptas culpa,WISH,Natasha,2,DOING
T8296,Perspiciatis velit sequi quam quae doloribus iusto,WISH,Natasha,15,DONE
T8297,Veritatis tempora facere excepturi soluta,SHOULD,Natasha,15,DONE
T8298,Incidunt aut iusto delectus,COULD,Natasha,2,DONE
T8299,Deleniti iusto officiis velit distinctio explicabo vitae rem aspernatur,MUST,Joe,1,DONE
T8300,Soluta quae vitae iusto architecto facere,SHOULD,Natasha,1,TODO
T8301,Nesciunt et quisquam possimus,WISH,Joe,15,DOING
T8302,Natus quasi voluptas cupiditate libero ut necessitatibus amet sapiente,WISH,Natasha,7,DONE
T8303,Recusandae dolor,MUST,Joe,7,DOING
T8304,Non fuga incidunt ad a aut,COULD,Natasha,10,DONE
T8305,Reprehenderit officia dolores doloribus iste,MUST,Natasha,10,TODO
T8306,Natus culpa tempore sint quod numquam,COULD,Joe,2,TODO
T8307,Hic dignissimos error,SHOULD,Mike,1,DONE
T8308,Quisquam aut repudiandae deserunt autem expedita beatae,WISH,Natasha,15,DONE
T8309,Fuga praesentium minima unde hic ipsa,COULD,Natasha,15,DONE
T8310,Blanditiis eveniet natus quas quis omnis magnam autem aliquam,COULD,Mike,15,DOING
T8311,Accusantium sapiente rerum natus maxime nesciunt,WISH,Joe,10,TODO
T8312,Ullam natus doloremque vel nulla eum libero soluta aut,COULD,Joe,15,DONE
T8313,Impedit repellat reiciendis ad aperiam,WISH,Natasha,7,DONE
T8314,Magni laboriosam itaque quis assumenda,COULD,Natasha,1,DONE
T8315,Reprehenderit voluptatum repellat illum,MUST,Joe,10,TODO
T8316,Maiores a assumenda nihil omnis beatae,WISH,Natasha,1,DONE
T8317,Reprehenderit dolore iusto blanditiis voluptates,COULD,Natasha,1,DONE
T8318,Temporibus ipsum adipisci fugiat recusandae quod assumenda cumque,COULD,Joe,10,DONE
T8319,Non ullam,COULD,Mike,2,DONE
T8320,Neque earum nesciunt est accusantium eveniet,COULD,Natasha,7,DONE
T8321,Assumenda beatae ratione id necessitatibus beatae,COULD,Joe,10,DONE
T8322,Illum facere,WISH,Joe,2,DONE
T8323,Iusto ab iusto quis placeat,SHOULD,Mike,1,DONE
T8324,Repudiandae voluptates soluta corrupti dolore repudiandae aliquid,COULD,Natasha,1,DONE
T8325,Necessitatibus iusto sint delectus,COULD,Joe,2,DONE
T8326,Quasi neque unde,COULD,Joe,10,DOING
T8327,Ullam eaque culpa,SHOULD,Natasha,7,TODO
T8328,Iste aut explicabo animi tenetur consequuntur nemo dolore quibusdam,COULD,Natasha,2,DONE
T8329,Labore necessitatibus natus atque rem,SHOULD,Natasha,10,DONE
T8330,Voluptatem hic consectetur nam sed repudiandae nemo magni unde distinctio,COULD,Joe,7,TODO
T8331,Non illum est,WISH,Natasha,2,TODO
T8332,Delectus a ullam accusantium eligendi,COULD,Mike,1,DONE
T8333,Deleniti expedita temporibus inventore odit suscipit magni,SHOULD,Natasha,15,DONE
T8334,Omnis laboriosam voluptates sint,COULD,Joe,15,DONE
T8335,Cupiditate rerum a distinctio mollitia,COULD,Joe,10,DONE
T8336,Error perferendis sit dignissimos,WISH,Joe,1,DONE
T8337,Nostrum harum cumque ab,MUST,Joe,10,DONE
T8338,Quisquam cumque nesciunt dolorem consequatur quaerat quasi,COULD,Natasha,10,DONE
T8339,Maxime distinctio vero maxime,SHOULD,Natasha,1,DONE
T8340,Recusandae fugiat,MUST,Mike,15,DOING
T8341,Numquam veniam excepturi quibusdam animi nemo esse,COULD,Natasha,7,DOING
T8342,Non a temporibus,MUST,Joe,10,DONE
T8343,At necessitatibus occaecati non occaecati,SHOULD,Natasha,7,DONE
T8344,Hic sit pariatur suscipit voluptate voluptate itaque sint,WISH,Joe,10,TODO
T8345,Quo amet ratione impedit,COULD,Natasha,2,DOING
T8346,Corporis modi doloremque,WISH,Mike,15,DONE
T8347,Corporis numquam minima nobis sint iusto ab,WISH,Natasha,2,DONE
T8348,Numquam eius fugiat quam est fuga,WISH,Joe,3,DOING
T8349,Reprehenderit dolor nobis,WISH,Joe,15,TODO
T8350,Repellendus nemo praesentium beatae rerum quas dolorum porro,SHOULD,Joe,7,DONE
T8351,Architecto laborum labore quod rerum dolores,SHOULD,Joe,1,DONE
T8352,Quidem,MUST,Natasha,2,DONE
T8353,Minus aperiam saepe modi tempora accusamus,MUST,Joe,10,DOING
T8354,Quaerat rem amet magni illo cum,MUST,Mike,1,TODO
T8355,Explicabo laudantium deserunt,COULD,Joe,10,DONE
T8356,Numquam rerum,COULD,Joe,15,DONE
T8357,Consequuntur quas vero beatae,WISH,Joe,1,TODO
T8358,Animi perferendis error,WISH,Joe,1,DONE
T8359,Cum consectetur,WISH,Joe,10,DONE
T8360,Non voluptas numquam necessitatibus quod,WISH,Joe,10,DONE
T8361,Suscipit iusto porro eligendi fugit,WISH,Joe,2,TODO
T8362,Libero suscipit cumque rerum ipsa,COULD,Joe,2,DONE
T8363,Vel sapiente architecto sit maxime,COULD,Joe,10,DOING
T8364,Reprehenderit facere mollitia corrupti,SHOULD,Joe,2,DONE
T8365,Praesentium magni mollitia autem repudiandae,MUST,Mike,2,TODO
T8366,At nemo,SHOULD,Natasha,10,DONE
T8367,Incidunt placeat ipsa,SHOULD,Natasha,2,TODO
T8368,Placeat reiciendis expedita dolorum,COULD,Joe,1,DONE
T8369,Illum earum,WISH,Natasha,15,DONE
T8370,Deserunt excepturi nobis,SHOULD,Mike,3,TODO
T8371,Corporis qui,WISH,Natasha,1,DONE
T8372,Maiores explicabo hic,WISH,Natasha,10,DONE
T8373,Natus distinctio perferendis modi deserunt libero labore reprehenderit libero,WISH,Natasha,15,DONE
T8374,Impedit ipsum,COULD,Natasha,10,DONE
T8375,Pariatur molestias amet nisi consectetur minima non,MUST,Joe,1,DONE
T8376,Rem molestiae voluptatum atque eum,COULD,Natasha,10,DONE
T8377,Architecto architecto asperiores ipsa provident sit occaecati assumenda,COULD,Joe,10,DONE
T8378,Molestias qui non veritatis,SHOULD,Natasha,7,TODO
T8379,Harum provident commodi esse iste,WISH,Joe,10,DONE
T8380,Commodi adipisci quasi harum laboriosam,SHOULD,Joe,15,DONE
T8381,Dolorum asperiores quos,COULD,Joe,2,DONE
T8382,Iusto exercitationem eligendi itaque vel earum,WISH,Joe,1,DONE
T8383,Accusamus molestias itaque aliquam excepturi mollitia atque est perspiciatis,WISH,Natasha,7,DOING
T8384,Esse voluptatibus omnis ipsum ipsam ex illum,MUST,Mike,2,DONE
T8385,Omnis assumenda,WISH,Joe,7,TODO
T8386,Eius asperiores maiores,COULD,Joe,10,TODO
T8387,Quidem ipsum deserunt facilis minus nulla vitae qui magnam magnam,COULD,Natasha,10,DONE
T8388,Laborum debitis aliquam consequatur reprehenderit dolore et quas vitae,COULD,Joe,7,DONE
T8389,Saepe molestiae quasi consequuntur,SHOULD,Joe,15,DONE
T8390,Iste quaerat consequuntur,SHOULD,Mike,2,DONE
T8391,Provident aperiam eaque quis,COULD,Joe,10,DONE
T8392,Rerum voluptatum repellendus aut,MUST,Natasha,10,DONE
T8393,Corrupti debitis et,MUST,Joe,15,DONE
T8394,Corporis consequuntur,WISH,Joe,15,DONE
T8395,Numquam laborum consectetur,WISH,Joe,1,DONE
T8396,Perferendis esse tempora,COULD,Joe,2,DOING
T8397,Eligendi vero distinctio reiciendis quas atque voluptatibus,COULD,Natasha,10,DONE
T8398,Illo dolores alias quibusdam animi,WISH,Joe,7,TODO
T8399,Iure itaque nostrum officia pariatur,MUST,Mike,15,DONE
T8400,Soluta ea voluptatum consequatur aut,WISH,Joe,1,DONE
T8401,Fugit ab repudiandae laboriosam quos doloremque,WISH,Mike,15,DONE
T8402,Quidem laudantium dignissimos cupiditate quam,WISH,Joe,10,DONE
T8403,Maiores est voluptatum labore nihil,COULD,Mike,15,DONE
T8404,Laborum magni consectetur modi reprehenderit eaque veniam nihil provident odio,COULD,Joe,1,TODO
T8405,Nostrum harum asperiores impedit,COULD,Joe,2,TODO
T8406,Id rem nemo maiores facilis itaque,SHOULD,Natasha,2,TODO
T8407,Autem beatae sint,COULD,Joe,1,TODO
T8408,Quidem harum inventore voluptate,SHOULD,Joe,15,DOING
T8409,Laudantium voluptates incidunt beatae beatae modi amet unde,COULD,Joe,10,DONE
T8410,Assumenda fugiat velit quos nostrum at quae incidunt,SHOULD,Joe,10,DONE
T8411,Hic a odio dolorem mollitia praesentium iusto illo iusto,COULD,Joe,2,DONE
T8412,Sequi doloremque exercitationem,COULD,Natasha,1,DONE
T8413,Ratione saepe est,SHOULD,Joe,10,DONE
T8414,Temporibus necessitatibus,WISH,Mike,10,DONE
T8415,Beatae sed,SHOULD,Joe,1,DONE
T8416,Fuga autem odio,COULD,Joe,1,DOING
T8417,Quas expedita eaque perferendis,MUST,Natasha,2,DONE
T8418,Consequuntur quaerat quis veniam quos optio,MUST,Mike,10,DONE
T8419,Aliquid illo incidunt,WISH,Joe,10,DOING
T8420,Eveniet quia deleniti,WISH,Mike,10,DONE
T8421,Expedita omnis optio,SHOULD,Joe,1,DONE
T8422,Nulla a,WISH,Natasha,7,DONE
T8423,Quis magnam magni,MUST,Mike,15,DONE
T8424,Excepturi quas necessitatibus id distinctio,COULD,Natasha,15,DONE
T8425,Ipsum possimus beatae aut voluptate,MUST,Joe,1,DONE
T8426,Ab ullam optio totam maiores labore hic deserunt,COULD,Mike,10,DONE
T8427,Facilis maiores officiis fugiat sit,SHOULD,Joe,2,DONE
T8428,Eum dolorem error voluptate qui commodi,COULD,Joe,10,DOING
T8429,Similique cum eos ipsam animi sequi accusantium nemo,SHOULD,Joe,4,DONE
T8430,Culpa similique facilis saepe commodi,COULD,Natasha,10,TODO
T8431,In omnis nulla,COULD,Joe,2,DONE
T8432,Cumque libero sed,WISH,Natasha,15,DONE
T8433,Odit debitis,WISH,Natasha,15,DONE
T8434,Provident culpa laudantium distinctio,COULD,Joe,3,DONE
T8435,Perspiciatis fuga corporis aliquam eligendi suscipit repellendus cum adipisci praesentium corrupti,COULD,Joe,10,DONE
T8436,Praesentium a error ipsum fugiat doloribus quisquam,MUST,Natasha,10,DONE
T8437,Eos iure aut molestias omnis quod consectetur modi provident,COULD,Natasha,10,DOING
T8438,Fugit ea odio voluptatum rerum perferendis totam,MUST,Joe,1,DOING
T8439,Nisi nobis incidunt architecto quo ipsa sint delectus quod corporis,WISH,Mike,10,DONE
T8440,Natus nemo labore dolorum suscipit minima ea a,SHOULD,Natasha,7,DONE
T8441,Aspernatur quis perspiciatis itaque porro velit non suscipit,WISH,Natasha,1,DOING
T8442,Voluptatum aliquid quisquam iure nesciunt laboriosam,COULD,Mike,10,DOING
T8443,Expedita amet,COULD,Joe,1,DONE
T8444,Sunt dolor dignissimos ducimus libero delectus dolor,COULD,Mike,2,DONE
T8445,Nisi sint dolores accusamus voluptatem,COULD,Joe,1,DONE
T8446,Ratione voluptatem cumque ipsum aliquam,SHOULD,Joe,15,DONE
T8447,Fugiat illo maiores corporis repellat quam,SHOULD,Joe,1,DONE
T8448,Natus cupiditate,COULD,Joe,2,DONE
T8449,Molestias distinctio ipsa,MUST,Mike,2,DOING
T8450,Maxime rem pariatur hic magni voluptatibus enim,WISH,Joe,10,DOING
T8451,Reprehenderit quasi provident impedit,SHOULD,Joe,10,DONE
T8452,Labore autem nihil,COULD,Natasha,10,DONE
T8453,Necessitatibus voluptate,SHOULD,Mike,10,DONE
T8454,Dolore vitae occaecati,SHOULD,Joe,15,DOING
T8455,Voluptas doloremque accusamus,WISH,Natasha,2,DONE
T8456,Rem aperiam,COULD,Mike,1,DONE
T8457,Officia reprehenderit iure corrupti iure alias,MUST,Mike,7,TODO
T8458,Aliquid dignissimos similique consectetur illo quis deleniti deleniti,WISH,Joe,4,DONE
T8459,Praesentium maiores iure quaerat,WISH,Joe,10,DONE
T8460,Voluptatum quidem laborum enim,MUST,Natasha,1,TODO
T8461,Quidem voluptates iusto minus repellendus fugit,MUST,Mike,1,DONE
T8462,Voluptate unde tempora minus nulla,MUST,Joe,2,DOING
T8463,Sequi quo doloremque quae nam possimus ipsum doloribus nulla necessitatibus,WISH,Mike,2,DOING
T8464,Natus nobis,SHOULD,Joe,15,DONE
T8465,Esse aperiam nam aut,WISH,Natasha,1,TODO
T8466,Esse eum dolorum asperiores incidunt eveniet harum repellat id,WISH,Natasha,1,DONE
T8467,Amet nobis neque assumenda dolor vel facere eum,MUST,Mike,10,TODO
T8468,At fuga quod deserunt temporibus reiciendis ipsam in unde,COULD,Joe,1,TODO
T8469,Voluptatibus corporis facilis expedita eos,WISH,Joe,10,DONE
T8470,Explicabo harum similique quaerat laborum voluptas animi,COULD,Mike,7,DONE
T8471,Temporibus quasi laborum sequi,WISH,Joe,10,DONE
T8472,Voluptas dolore cupiditate veniam,SHOULD,Natasha,10,DONE
T8473,Reprehenderit exercitationem laborum,SHOULD,Mike,10,TODO
T8474,Perferendis laboriosam magnam dolore laboriosam quibusdam molestiae maxime,SHOULD,Joe,2,DONE
T8475,Quo nihil,COULD,Natasha,2,TODO
T8476,Perspiciatis quae voluptatibus sint iure nam minima,COULD,Joe,10,TODO
T8477,Et laudantium occaecati,COULD,Joe,7,DONE
T8478,Officiis voluptates officia aliquam cum amet laudantium voluptas,COULD,Mike,1,DONE
T8479,Nihil animi omnis officiis doloremque quo iusto,WISH,Joe,2,DONE
T8480,Unde alias quaerat dolore dignissimos,WISH,Natasha,10,DONE
T8481,Quia quis repudiandae similique repellendus beatae,WISH,Joe,15,DOING
T8482,Quas eius dolorem,SHOULD,Mike,3,DONE
T8483,Atque eius maiores maiores blanditiis velit,WISH,Joe,1,DOING
T8484,Veritatis perferendis quia,COULD,Mike,10,TODO
T8485,Ipsum eveniet dignissimos libero,COULD,Natasha,10,DONE
T8486,Vel blanditiis distinctio,WISH,Joe,2,TODO
T8487,Laborum ducimus delectus,COULD,Joe,10,DONE
T8488,Rem tempore perspiciatis officiis dignissimos,SHOULD,Joe,15,TODO
T8489,Quam officia earum consequuntur reiciendis,COULD,Natasha,10,DONE
T8490,Dolorem eius reprehenderit atque incidunt aspernatur,COULD,Joe,1,DONE
T8491,Vitae iusto quo,WISH,Natasha,15,TODO
T8492,Culpa omnis maiores distinctio corrupti iure,COULD,Joe,7,DONE
T8493,Eum corporis sit minima reprehenderit culpa nesciunt,WISH,Mike,2,DONE
T8494,Earum tenetur laborum eligendi qui,SHOULD,Joe,10,DOING
T8495,Quasi ipsa ullam iure ad laborum doloremque,COULD,Mike,10,DONE
T8496,Ipsum esse possimus animi ad,SHOULD,Natasha,15,TODO
T8497,Ut excepturi quia,COULD,Natasha,7,DONE
T8498,Ut esse neque voluptates perspiciatis voluptas facilis voluptate,COULD,Natasha,15,DONE
T8499,Repellat maiores,WISH,Natasha,2,DONE
T8500,Molestias labore veniam,SHOULD,Mike,1,DONE
T8501,Vero impedit sapiente debitis,WISH,Mike,2,DONE
T8502,Molestias mollitia nobis quidem,MUST,Joe,15,DONE
T8503,Dolores ipsum adipisci ipsum dolorum,COULD,Mike,15,DONE
T8504,Repudiandae itaque quidem perspiciatis,WISH,Natasha,10,DONE
T8505,Alias sequi,COULD,Joe,1,TODO
T8506,Consequuntur ipsam tempore tempore nobis exercitationem minus,COULD,Joe,7,TODO
T8507,Quaerat blanditiis perspiciatis quae asperiores ab sint magni,SHOULD,Mike,7,TODO
T8508,Quos similique rerum similique voluptatibus in ut vero,SHOULD,Joe,15,TODO
T8509,Aperiam ab autem nisi omnis magnam,WISH,Joe,1,DONE
T8510,Repellendus rem nulla,MUST,Natasha,10,DONE
T8511,Iste error nam dolore repudiandae,COULD,Joe,10,TODO
T8512,Quis ratione quaerat,MUST,Joe,2,DONE
T8513,Sapiente omnis quidem ex perspiciatis nisi,SHOULD,Mike,10,DONE
T8514,Ipsum fugit rem,SHOULD,Joe,1,DONE
T8515,Provident eius possimus iste voluptate veritatis in et quasi nesciunt,COULD,Natasha,15,TODO
T8516,Harum aperiam debitis officiis,SHOULD,Joe,1,DONE
T8517,Molestias cumque fugiat sed doloremque occaecati,COULD,Natasha,2,DONE
T8518,Hic occaecati pariatur eveniet eos adipisci,COULD,Joe,7,DONE
T8519,Fugiat sunt nulla,COULD,Joe,10,DONE
T8520,Magni est fugiat,MUST,Mike,1,DONE
T8521,Adipisci veritatis perspiciatis laborum,WISH,Natasha,1,DONE
T8522,Repellat quis,SHOULD,Joe,10,DOING
T8523,Quisquam voluptatum vitae eos perferendis a,WISH,Natasha,2,DONE
T8524,Dicta,WISH,Joe,15,DOING
T8525,Nemo dolores quo delectus ipsam,COULD,Joe,7,DONE
T8526,Sunt doloribus non soluta ducimus necessitatibus,COULD,Natasha,2,DONE
T8527,Reprehenderit tempore maxime,SHOULD,Mike,10,DONE
T8528,Quia nobis ducimus,COULD,Natasha,2,DONE
T8529,Accusamus impedit voluptatem doloremque voluptate,COULD,Joe,15,DONE
T8530,Officia nobis quia officia cumque dicta,COULD,Natasha,2,DONE
T8531,Ipsam delectus illum iusto voluptatum,COULD,Joe,7,DOING
T8532,Voluptatem accusamus minus ducimus alias molestias vel dolorem omnis,SHOULD,Joe,10,DONE
T8533,Consequuntur aperiam quisquam,WISH,Mike,2,DONE
T8534,Exercitationem sunt sit aliquam,WISH,Natasha,1,DONE
T8535,Vero quaerat voluptate a,SHOULD,Natasha,1,TODO
T8536,Totam labore dolores,SHOULD,Joe,1,DONE
T8537,Tenetur possimus atque perspiciatis,WISH,Natasha,15,DONE
T8538,Mollitia laborum quae accusamus deserunt et eligendi itaque,COULD,Joe,2,DOING
