id,name,priority,who,time,status
T1000,Incidunt praesentium qui velit eligendi ullam,COULD,Joe,15,DONE
T1001,Fugiat soluta,SHOULD,Mike,15,DOING
T1002,Esse commodi,WISH,Joe,1,DONE
T1003,Error soluta ea,COULD,Joe,10,DOING
T1004,Quasi maiores,COULD,Mike,7,DONE
T1005,Voluptate unde sit excepturi repellat vero placeat,COULD,Mike,1,DONE
T1006,Harum voluptatem optio nisi,COULD,Joe,15,TODO
T1007,Assumenda fugiat,WISH,Joe,2,DONE
T1008,Nemo sequi fugit error beatae alias,SHOULD,Joe,1,DONE
T1009,Nobis doloremque dolorum,WISH,Joe,2,DONE
T1010,Quas numquam neque dignissimos rem,WISH,Natasha,2,DONE
T1011,Iusto molestiae nulla velit animi numquam expedita dolore ab,SHOULD,Natasha,10,DONE
T1012,Ipsam odit,COULD,Joe,10,DONE
T1013,Quibusdam aut ad sapiente quaerat,SHOULD,Joe,1,DONE
T1014,Temporibus in velit in,WISH,Joe,2,TODO
T1015,Repudiandae nobis soluta,WISH,Joe,7,DONE
T1016,Beatae iste iure porro,COULD,Natasha,15,TODO
T1017,Quis excepturi sed accusantium,COULD,Natasha,1,TODO
T1018,Quod praesentium doloremque sint iure sequi blanditiis amet,COULD,Joe,2,DONE
T1019,Rerum ad incidunt quidem nostrum consectetur quasi,SHOULD,Natasha,1,DONE
T1020,Rerum tempora deserunt voluptatum magnam porro voluptatum similique illo,COULD,Natasha,7,DONE
T1021,Magnam corrupti minus dicta vel,SHOULD,Joe,1,DONE
T1022,Consectetur sunt hic magni consequuntur,MUST,Joe,10,DONE
T1023,Maxime nesciunt,COULD,Joe,15,DOING
T1024,Magni veniam quo provident neque,WISH,Joe,10,DONE
T1025,Tempora totam,SHOULD,Joe,10,TODO
T1026,Repudiandae delectus vitae ipsam,COULD,Joe,1,DONE
T1027,Error magnam aliquid qui modi,MUST,Joe,15,DONE
T1028,Voluptas ea fugit ipsa occaecati,SHOULD,Joe,7,DONE
T1029,Occaecati eveniet officia eius totam,COULD,Natasha,7,TODO
T1030,Neque nam,WISH,Joe,2,TODO
T1031,Id cum aliquid exercitationem doloremque sunt,MUST,Mike,10,DONE
T1032,Labore optio atque vero facilis voluptas facere,COULD,Joe,10,DONE
T1033,Voluptate consequatur animi et,COULD,Joe,10,TODO
T1034,Quibusdam facere harum sunt,COULD,Joe,2,DONE
T1035,Id saepe voluptates beatae sapiente,WISH,Joe,2,DONE
T1036,Corporis cumque culpa,MUST,Joe,7,DOING
T1037,Quidem laboriosam quod,WISH,Natasha,15,DONE
T1038,Aut quod numquam illum sit,COULD,Natasha,10,TODO
T1039,Incidunt quam sunt laborum blanditiis,COULD,Natasha,1,TODO
T1040,Magnam laudantium quis molestiae debitis,SHOULD,Mike,10,DONE
T1041,Accusamus tenetur,WISH,Joe,15,DONE
T1042,Beatae tempore,WISH,Natasha,10,DONE
T1043,Dolore omnis autem harum,COULD,Natasha,1,DONE
T1044,Quos animi,WISH,Natasha,15,DONE
T1045,Deleniti veritatis tempora occaecati similique,SHOULD,Natasha,10,DOING
T1046,Iure rem,COULD,Joe,15,DONE
T1047,Cum occaecati corporis autem itaque,SHOULD,Mike,15,DOING
T1048,Assumenda voluptate,COULD,Natasha,2,DONE
T1049,Sapiente sunt vitae reiciendis,COULD,Mike,1,TODO
T1050,Amet harum dignissimos accusantium occaecati quas cupiditate,WISH,Natasha,10,DONE
T1051,Nulla corporis asperiores,SHOULD,Mike,2,DONE
T1052,Eum saepe velit provident ut amet eum atque,COULD,Mike,7,TODO
T1053,Doloribus quis deleniti nam nobis dolore nostrum,COULD,Natasha,10,DOING
T1054,Suscipit quasi officiis quaerat,COULD,Natasha,7,DONE
T1055,Ab voluptatem quis aspernatur explicabo omnis,COULD,Natasha,1,DONE
T1056,Inventore veniam veniam nulla laboriosam nam at aliquid,COULD,Joe,2,DOING
T1057,Est ullam repudiandae quidem dignissimos,SHOULD,Joe,15,DOING
T1058,Rem unde,WISH,Joe,2,DONE
T1059,Mollitia aspernatur sunt praesentium labore,COULD,Mike,1,DONE
T1060,Nemo necessitatibus voluptatibus sapiente at quisquam,WISH,Joe,2,DONE
T1061,Adipisci incidunt molestias ipsum ipsa omnis,WISH,Joe,2,DONE
T1062,Beatae reprehenderit voluptates eligendi porro,WISH,Mike,15,DONE
T1063,Mollitia minima reiciendis molestiae,COULD,Joe,3,TODO
T1064,Nihil blanditiis facere vero,WISH,Joe,2,DONE
T1065,Eaque soluta voluptatibus perspiciatis ad architecto in praesentium,SHOULD,Mike,1,TODO
T1066,Quis minus praesentium,COULD,Mike,15,DOING
T1067,Aut aliquid at quos,COULD,Natasha,10,DONE
T1068,Molestiae expedita vero,WISH,Mike,15,DONE
T1069,Quis unde nostrum natus,WISH,Joe,1,TODO
T1070,Quibusdam cumque ad ea,COULD,Joe,10,DONE
T1071,Voluptates consequuntur fugiat atque laudantium fuga tempore ut tenetur,MUST,Joe,7,DONE
T1072,Quia modi quasi consequuntur,WISH,Natasha,2,DONE
T1073,Incidunt possimus aspernatur repellendus nulla voluptatum sit,COULD,Natasha,15,DONE
T1074,Ab reiciendis illo,WISH,Joe,1,DOING
T1075,Sed nulla adipisci asperiores tempora itaque,SHOULD,Joe,2,DONE
T1076,Excepturi,COULD,Joe,1,DONE
T1077,Velit tempore velit repellat optio cum quis,WISH,Joe,10,DONE
T1078,Et ad quibusdam odit harum quisquam,WISH,Joe,2,TODO
T1079,Quas maxime quidem aperiam quos neque dolorem,MUST,Natasha,2,DONE
T1080,Dolores aspernatur impedit,WISH,Joe,15,DONE
T1081,Cupiditate,COULD,Joe,2,DONE
T1082,Animi laborum pariatur,COULD,Joe,1,DONE
T1083,Omnis illum nihil quod placeat velit ullam,WISH,Joe,15,DONE
T1084,Ab doloribus iste molestiae dicta,MUST,Mike,2,DONE
T1085,Nisi a impedit,WISH,Natasha,1,DONE
T1086,Atque optio atque in,COULD,Natasha,2,DONE
T1087,Reprehenderit beatae eveniet,COULD,Natasha,2,DONE
T1088,Atque aut,COULD,Natasha,7,DONE
T1089,Omnis,COULD,Joe,15,DONE
T1090,Odit similique reiciendis iure,COULD,Natasha,10,TODO
T1091,Iusto velit sunt officia numquam quasi sapiente,COULD,Joe,2,DONE
T1092,Corrupti saepe soluta ea,SHOULD,Joe,1,DONE
T1093,Officiis,COULD,Mike,10,DONE
T1094,Velit rem natus rem labore explicabo consectetur tempora,SHOULD,Mike,7,DONE
T1095,Laboriosam,COULD,Mike,15,TODO
T1096,Quidem inventore alias temporibus porro vitae sequi,COULD,Natasha,10,DONE
T1097,Vitae dolorem beatae explicabo,COULD,Mike,10,TODO
T1098,Sed alias unde eius,MUST,Joe,10,TODO
T1099,Itaque dolorem,WISH,Joe,10,DONE
T1100,Reiciendis incidunt quidem laborum ea error,COULD,Joe,7,DONE
T1101,Aspernatur sint nesciunt,COULD,Mike,1,TODO
T1102,Eveniet odio dicta aliquid natus,COULD,Mike,15,TODO
T1103,Labore neque ea vero sint incidunt,SHOULD,Joe,1,DONE
T1104,Optio rerum repellat nulla omnis perspiciatis,COULD,Joe,15,TODO
T1105,Ullam quisquam,SHOULD,Joe,7,DONE
T1106,Nisi sit impedit ullam necessitatibus,WISH,Joe,10,DOING
T1107,Minus ullam quae,COULD,Joe,2,TODO
T1108,Sint omnis excepturi dicta,SHOULD,Natasha,2,DONE
T1109,Non cum debitis,COULD,Joe,2,DONE
T1110,Cum quisquam eligendi ab,COULD,Joe,7,TODO
T1111,A ab error dicta voluptates ullam iure,COULD,Natasha,10,DONE
T1112,Ducimus at,COULD,Natasha,15,DONE
T1113,Incidunt dolores doloremque qui neque,SHOULD,Natasha,7,DONE
T1114,Odit numquam aliquam quod,SHOULD,Mike,15,DONE
T1115,Asperiores laboriosam voluptas a ullam sit ex odit,WISH,Natasha,7,DONE
T1116,Mollitia nisi amet quasi aliquid quibusdam voluptas ducimus consectetur qui tempore,WISH,Joe,15,DONE
T1117,Repellat perferendis nemo corporis natus,MUST,Joe,15,DONE
T1118,Ipsa molestias ut,COULD,Mike,10,DONE
T1119,Voluptates reiciendis reprehenderit non occaecati,COULD,Joe,2,TODO
T1120,Sunt voluptatem quod laborum maiores aspernatur id impedit numquam doloremque ducimus,MUST,Natasha,15,DONE
T1121,Deserunt nihil quibusdam nesciunt ducimus ipsa in,COULD,Natasha,15,DONE
T1122,Saepe eos odio in,COULD,Mike,2,TODO
T1123,Saepe similique necessitatibus quis nesciunt enim nam,SHOULD,Mike,10,DOING
T1124,Tenetur aspernatur sint aperiam,WISH,Joe,10,DONE
T1125,Quo incidunt dignissimos nesciunt modi tempore dignissimos repellat libero officiis,SHOULD,Joe,3,DOING
T1126,Amet ullam asperiores quia iure amet quis inventore unde tempora,WISH,Joe,15,DOING
T1127,Quam maxime reiciendis fuga amet in totam accusamus iure accusamus,SHOULD,Joe,1,DONE
T1128,Quam accusantium placeat facilis,WISH,Natasha,2,DONE
T1129,Ipsum quasi maxime ipsum iure quibusdam blanditiis quibusdam aliquid,COULD,Joe,2,DOING
T1130,Accusantium quae,SHOULD,Joe,10,TODO
T1131,Officia assumenda vero voluptates est voluptatibus eveniet in soluta iste,WISH,Mike,2,DONE
T1132,Velit eum hic nam eos,WISH,Joe,10,DONE
T1133,Aliquam rem corporis modi,COULD,Natasha,10,DONE
T1134,Dolorum culpa voluptates,WISH,Natasha,1,DONE
T1135,Molestiae quis voluptatibus enim,WISH,Natasha,15,TODO
T1136,Ratione libero dignissimos,SHOULD,Natasha,15,TODO
T1137,Rem aliquam numquam voluptatem voluptatem,WISH,Joe,7,DONE
T1138,Et voluptate vero,SHOULD,Mike,10,TODO
T1139,Dolores omnis voluptatibus architecto dolores,WISH,Joe,15,DONE
T1140,Porro doloremque omnis,SHOULD,Joe,2,DONE
T1141,Commodi quasi officia,WISH,Joe,10,DONE
T1142,Quibusdam temporibus aspernatur aut quidem,MUST,Mike,10,DOING
T1143,Repudiandae facere suscipit id,SHOULD,Joe,10,TODO
T1144,Nesciunt iste fugiat tempore fugiat,COULD,Mike,2,DONE
T1145,Excepturi saepe nemo deserunt voluptates perspiciatis expedita,COULD,Natasha,1,DONE
T1146,Soluta ipsam fugiat culpa magnam,COULD,Mike,10,DONE
T1147,Placeat fugit cumque,WISH,Natasha,1,DOING
T1148,Ut nesciunt ad beatae illum unde quas dolorem earum,SHOULD,Natasha,10,DONE
T1149,Quibusdam aliquam tempore sint iusto odit animi,SHOULD,Joe,15,TODO
T1150,Vel labore laborum,WISH,Joe,15,TODO
T1151,Recusandae quo sed quis,MUST,Joe,7,DONE
T1152,Delectus,COULD,Joe,10,DONE
T1153,Et ea doloremque fuga praesentium,COULD,Joe,7,DOING
T1154,Eaque soluta,SHOULD,Joe,15,DOING
T1155,Eius deleniti labore porro ipsum,WISH,Natasha,2,DONE
T1156,Rerum maxime debitis illo et cum,SHOULD,Natasha,1,TODO
T1157,Explicabo ab,COULD,Natasha,1,DONE
T1158,Laborum officia magnam magni debitis,COULD,Mike,15,DOING
T1159,Nulla laudantium laudantium rem natus,MUST,Joe,2,TODO
T1160,Tempore unde libero consequuntur aspernatur,COULD,Natasha,7,TODO
T1161,Voluptate dolores ratione animi modi,WISH,Joe,1,DONE
T1162,Ut hic quam,SHOULD,Joe,15,DONE
T1163,Velit cupiditate impedit est delectus facilis est nulla,COULD,Joe,1,DONE
T1164,Sed nobis blanditiis itaque molestias,WISH,Mike,15,DONE
T1165,Ab eos explicabo,COULD,Natasha,7,DONE
T1166,Tenetur voluptas cum harum laborum unde debitis pariatur,MUST,Natasha,10,DONE
T1167,Deserunt autem asperiores cupiditate,COULD,Mike,10,DOING
T1168,Modi tempora dignissimos totam illum animi ducimus sapiente sapiente ratione optio,WISH,Joe,1,DONE
T1169,Nulla velit harum laudantium ducimus ab ea commodi quod quibusdam,WISH,Natasha,10,DONE
T1170,Vero quo aliquid amet,MUST,Joe,10,DONE
T1171,Culpa ab facilis minus ad,COULD,Mike,2,DONE
T1172,Totam quibusdam delectus aliquam voluptas,SHOULD,Mike,1,DONE
T1173,Dicta fugit reiciendis,WISH,Natasha,1,DONE
T1174,Incidunt dolorum consequatur beatae distinctio vitae architecto ad vero itaque,COULD,Natasha,1,DONE
T1175,Rem aut est amet ad,COULD,Joe,1,DONE
T1176,Dolor ipsa,MUST,Joe,2,DONE
T1177,Neque quae perspiciatis facilis deserunt,WISH,Natasha,10,DONE
T1178,Neque corrupti similique,COULD,Joe,10,DONE
T1179,Provident architecto magnam,WISH,Joe,15,TODO
T1180,Non expedita in quisquam quos sapiente,SHOULD,Natasha,2,DONE
T1181,Ducimus magni magni distinctio laboriosam,WISH,Natasha,15,DONE
T1182,Eum atque amet distinctio magni temporibus,SHOULD,Joe,10,DONE
T1183,A sunt aliquam odio eligendi sint,MUST,Natasha,10,DONE
T1184,Perspiciatis numquam voluptatem occaecati sequi aut,WISH,Mike,15,DONE
T1185,Corrupti laudantium sunt ipsa earum atque,SHOULD,Natasha,10,DONE
T1186,Tempora nulla culpa sequi ea,SHOULD,Natasha,2,DONE
T1187,Omnis facilis consequatur necessitatibus optio,SHOULD,Joe,15,TODO
T1188,Excepturi sed quae,COULD,Mike,1,DONE
T1189,Ducimus et quo qui ipsam,COULD,Joe,10,DONE
T1190,Unde ratione,WISH,Joe,7,TODO
T1191,Aspernatur repellat rerum amet architecto perferendis soluta est sunt inventore sapiente,COULD,Joe,7,TODO
T1192,Neque fugit ad deserunt perspiciatis molestias,COULD,Natasha,1,DONE
T1193,Modi labore quasi vero laborum,WISH,Natasha,7,TODO
T1194,Tenetur architecto eos temporibus vitae,WISH,Mike,15,DONE
T1195,Eos facere cupiditate corporis doloremque,SHOULD,Joe,10,DONE
T1196,Dolore illo rerum vitae,SHOULD,Joe,2,DONE
T1197,Nulla quis minus quaerat illo maxime,WISH,Natasha,1,DONE
T1198,Occaecati quod nobis beatae repudiandae quam adipisci cupiditate earum,SHOULD,Joe,10,DONE
T1199,Deserunt recusandae quisquam ipsam voluptatibus,SHOULD,Natasha,10,TODO
T1200,Molestias saepe est distinctio libero porro ut temporibus,WISH,Natasha,10,DONE
T1201,Quo mollitia amet odit,COULD,Joe,10,DONE
T1202,Eius suscipit beatae ipsam,SHOULD,Natasha,1,DONE
T1203,Cum excepturi nostrum voluptates,MUST,Joe,2,DONE
T1204,Doloremque vitae deserunt,COULD,Joe,10,DONE
T1205,Fugiat ducimus fugit ullam nulla,SHOULD,Joe,15,DONE
T1206,Temporibus ut laboriosam excepturi,WISH,Natasha,10,DOING
T1207,Unde numquam eaque est,COULD,Joe,10,DONE
T1208,Soluta laboriosam aut quos mollitia delectus mollitia amet,WISH,Mike,15,DONE
T1209,Quasi dicta itaque eligendi,COULD,Joe,2,DONE
T1210,Dolorem dolorum placeat atque,SHOULD,Joe,10,DONE
T1211,A omnis eos,COULD,Natasha,2,DONE
T1212,Laudantium earum dolorem quis,SHOULD,Joe,15,TODO
T1213,Eos reiciendis placeat voluptatibus illo delectus,SHOULD,Joe,10,TODO
T1214,Aperiam non,WISH,Mike,7,DONE
T1215,Facilis sed dolores,COULD,Natasha,15,DONE
T1216,Quidem dignissimos quis quibusdam et,WISH,Joe,7,DONE
T1217,Ducimus recusandae optio quasi beatae,WISH,Natasha,10,DONE
T1218,Possimus culpa ullam vero odio,MUST,Natasha,7,DONE
T1219,Atque delectus sed pariatur impedit,COULD,Joe,1,DONE
T1220,Sit laborum adipisci facilis provident blanditiis accusamus nostrum exercitationem,WISH,Mike,15,DONE
T1221,Est dolore temporibus nulla deserunt voluptatem temporibus voluptas,WISH,Natasha,2,DONE
T1222,Minus minus itaque placeat ipsa atque,WISH,Mike,10,DOING
T1223,Dignissimos doloribus maxime,WISH,Natasha,2,TODO
T1224,Exercitationem exercitationem dolorem animi est,SHOULD,Joe,7,DONE
T1225,Maiores reprehenderit,WISH,Joe,2,DONE
T1226,Ad explicabo praesentium ipsa molestiae aperiam qui,COULD,Natasha,1,DONE
T1227,Fugiat est corporis aut architecto amet autem assumenda rem,COULD,Natasha,2,DONE
T1228,Eaque ex nulla maiores,WISH,Joe,1,DONE
T1229,Quae non quo corrupti est,SHOULD,Natasha,7,DONE
T1230,At molestiae commodi eius amet hic occaecati omnis quaerat,COULD,Joe,10,DONE
T1231,Pariatur esse tempora quia,WISH,Natasha,7,DOING
T1232,Ipsum expedita dolorem,COULD,Joe,10,DOING
T1233,Vitae itaque maxime occaecati ratione perspiciatis ex,WISH,Natasha,7,DONE
T1234,Aut quo nostrum,WISH,Joe,15,DONE
T1235,Veniam itaque recusandae,MUST,Joe,1,DONE
T1236,Nobis dolorem incidunt ratione consequatur,COULD,Mike,15,DONE
T1237,Animi expedita officia mollitia magnam sed necessitatibus,MUST,Joe,10,DONE
T1238,Vel rem perspiciatis ab tempore impedit,SHOULD,Joe,10,DONE
T1239,Doloremque velit nam nostrum voluptatem ratione,MUST,Joe,2,DONE
T1240,Repellendus cupiditate fugit praesentium,MUST,Joe,1,DOING
T1241,Aspernatur deserunt error occaecati nobis,WISH,Joe,10,DONE
T1242,Odio libero exercitationem distinctio esse a voluptas commodi,WISH,Natasha,2,DONE
T1243,Consequuntur dignissimos a rerum,SHOULD,Natasha,10,DONE
T1244,Enim blanditiis alias impedit,SHOULD,Natasha,7,DONE
T1245,Esse blanditiis soluta,COULD,Natasha,1,DONE
T1246,Expedita fugiat aspernatur consequatur quos tenetur asperiores ab,SHOULD,Joe,1,DOING
T1247,Praesentium laudantium sit quod debitis adipisci dicta,COULD,Mike,1,DONE
T1248,Recusandae perferendis inventore,COULD,Joe,2,TODO
T1249,Aut suscipit,WISH,Joe,1,DONE
T1250,Error inventore iure magni dolore,COULD,Natasha,1,TODO
T1251,Neque rerum repellat ducimus consectetur eligendi tempore,COULD,Joe,2,TODO
T1252,Sed consectetur ratione,MUST,Joe,10,DOING
T1253,Ad voluptas quidem odio dolorem,WISH,Joe,15,DONE
T1254,Dignissimos eos praesentium architecto explicabo libero,COULD,Joe,10,DONE
T1255,Tempora iure accusantium vitae aliquid deserunt commodi quo impedit quisquam,COULD,Joe,15,TODO
T1256,Molestias voluptas quaerat nam repellat aut,SHOULD,Joe,10,DONE
T1257,Nisi inventore accusantium amet labore,WISH,Joe,7,DONE
T1258,Dolorum ipsum saepe porro assumenda nulla,COULD,Joe,1,DONE
T1259,Aut perspiciatis aliquam,COULD,Joe,10,DONE
T1260,Error beatae facere esse,WISH,Joe,2,TODO
T1261,Aliquam ullam,WISH,Mike,7,DONE
T1262,Veniam voluptas culpa temporibus sapiente,WISH,Joe,10,DONE
T1263,Eligendi accusantium similique beatae porro quis,COULD,Natasha,10,DOING
T1264,Debitis saepe amet modi,COULD,Joe,15,DONE
T1265,Cum sapiente libero cum ipsam,WISH,Mike,10,DONE
T1266,Natus nisi nesciunt distinctio molestias rem,COULD,Natasha,2,DONE
T1267,Dolorum repudiandae dolorem quaerat temporibus sed accusantium amet,COULD,Natasha,10,DONE
T1268,Exercitationem maiores ad,COULD,Mike,15,DONE
T1269,Eum facere,WISH,Joe,2,TODO
T1270,Ab illum numquam et,WISH,Joe,15,DONE
T1271,Earum repellendus ea,COULD,Joe,2,DONE
T1272,Totam recusandae voluptatibus,COULD,Natasha,7,DONE
T1273,Vel quibusdam cum,WISH,Joe,7,DONE
T1274,Nulla tempora qui deleniti necessitatibus nulla quos quo autem facere,WISH,Mike,1,TODO
T1275,Aliquid nulla eius accusamus nesciunt,COULD,Joe,1,DONE
T1276,Nobis fuga eum beatae reprehenderit maxime error itaque assumenda,COULD,Joe,7,DONE
T1277,In dolor voluptas est molestiae,WISH,Joe,1,DONE
T1278,Dolorum voluptatum molestiae quas atque esse reiciendis corporis,COULD,Natasha,2,DONE
T1279,Dicta earum dolores,COULD,Natasha,1,DONE
T1280,Nemo architecto culpa,WISH,Natasha,10,DONE
T1281,Similique dignissimos iusto at excepturi ut,MUST,Mike,15,DONE
T1282,Blanditiis repellendus tenetur,MUST,Joe,2,TODO
T1283,Quisquam maiores,SHOULD,Joe,2,DONE
T1284,Illum dicta,COULD,Natasha,10,DONE
T1285,Cupiditate enim facere fugiat deserunt doloribus quos quibusdam earum nobis,MUST,Joe,2,DONE
T1286,Eos iure ipsum fuga voluptas eius blanditiis expedita,WISH,Mike,10,DONE
T1287,Quis saepe recusandae beatae sapiente quos,COULD,Joe,2,DONE
T1288,Veniam blanditiis sequi quam assumenda,WISH,Natasha,7,TODO
T1289,Libero cupiditate nostrum iure,COULD,Natasha,1,DONE
T1290,Explicabo quos expedita ducimus,COULD,Joe,2,DONE
T1291,Numquam illo incidunt,COULD,Mike,15,DONE
T1292,Ab ea,COULD,Natasha,15,DONE
T1293,Deserunt vero veniam culpa libero asperiores labore,SHOULD,Natasha,10,DONE
T1294,Deserunt officiis minus minus reiciendis ullam,COULD,Natasha,2,DONE
T1295,Quis quia enim fuga debitis,SHOULD,Natasha,10,TODO
T1296,Rerum fugiat eum tempora,SHOULD,Mike,1,DONE
T1297,Assumenda aut pariatur facilis dolore nesciunt magnam eos,COULD,Joe,2,TODO
T1298,Officia pariatur corrupti,WISH,Joe,10,DONE
T1299,Minima corporis incidunt,SHOULD,Joe,2,DONE
T1300,Porro error aspernatur optio laboriosam debitis libero unde porro,WISH,Joe,1,DONE
T1301,Id culpa odit velit libero accusantium aut,WISH,Natasha,15,DONE
T1302,Minima quis tempore reiciendis mollitia,MUST,Natasha,2,DONE
T1303,Commodi pariatur nam maxime quos qui recusandae nesciunt dolor,COULD,Natasha,10,DONE
T1304,Accusantium aliquam quisquam modi,SHOULD,Natasha,2,DONE
T1305,Aut nam nesciunt corrupti doloribus saepe,WISH,Joe,15,DONE
T1306,Dolore eligendi corrupti aliquam,SHOULD,Natasha,15,TODO
T1307,Adipisci culpa magni cumque,WISH,Natasha,10,TODO
T1308,Hic sequi neque hic,SHOULD,Joe,2,DOING
T1309,Reiciendis quod et ad neque,COULD,Natasha,7,TODO
T1310,Architecto eum enim nostrum distinctio dignissimos quos tempore,WISH,Joe,7,DONE
T1311,Sunt sunt est magni magnam,WISH,Joe,7,DONE
T1312,Veritatis expedita rerum fugiat sint officia assumenda placeat nulla blanditiis,MUST,Joe,1,DONE
T1313,Culpa vel,COULD,Joe,1,TODO
T1314,Odit magni perferendis quidem,COULD,Joe,10,DONE
T1315,Provident eaque sequi,COULD,Joe,2,DONE
T1316,Ullam consequuntur nostrum,COULD,Joe,2,DONE
T1317,Quos doloribus tempore porro facere doloremque cumque corporis natus,SHOULD,Natasha,15,DONE
T1318,Veritatis eius nostrum magnam magnam doloremque officiis amet,WISH,Mike,10,DONE
T1319,Ipsa sit modi fugit vitae repellat temporibus consectetur explicabo,COULD,Natasha,10,DOING
T1320,Repudiandae voluptatem corporis iste repellendus,WISH,Joe,10,DONE
T1321,Eius aliquid nulla harum nemo dolor,MUST,Natasha,15,DONE
T1322,Repellat quia neque,WISH,Joe,2,DONE
T1323,Sapiente laborum tenetur ab delectus et,WISH,Natasha,10,DONE
T1324,Voluptate quam nihil distinctio,COULD,Natasha,2,DONE
T1325,Architecto soluta eos perferendis possimus dolores qui asperiores dolorum,WISH,Natasha,15,DONE
T1326,Earum maxime harum,WISH,Joe,10,DONE
T1327,Ullam repellendus aliquid occaecati quae et non,COULD,Natasha,2,DONE
T1328,Maxime veniam ducimus sit voluptatibus ipsum dolore,SHOULD,Natasha,2,DOING
T1329,Magni quo,WISH,Joe,10,DONE
T1330,Dolorem ipsum dolore inventore ipsa ratione quia nostrum architecto,WISH,Joe,2,DONE
T1331,Aspernatur dolore alias veritatis magni,WISH,Mike,1,TODO
T1332,Voluptatem aliquid id,WISH,Natasha,2,DONE
T1333,Assumenda explicabo sapiente fugit maiores nisi itaque nesciunt,COULD,Joe,15,DONE
T1334,Nemo accusantium aperiam,MUST,Joe,7,DONE
T1335,Incidunt deserunt architecto eum saepe at,COULD,Natasha,7,DONE
T1336,Minima cum,WISH,Natasha,7,DONE
T1337,Ex eum eligendi,COULD,Mike,7,DONE
T1338,Porro incidunt laudantium optio,WISH,Joe,1,TODO
T1339,Maiores,SHOULD,Joe,10,DONE
T1340,Labore soluta,COULD,Natasha,1,DONE
T1341,Tempore id exercitationem ipsam,COULD,Mike,10,DONE
T1342,Minima perferendis atque saepe nobis reiciendis numquam unde officiis quibusdam,COULD,Joe,10,DONE
T1343,Similique in,COULD,Joe,15,TODO
T1344,Ipsum explicabo adipisci cupiditate tempore voluptas,COULD,Joe,7,DONE
T1345,Natus officiis natus reprehenderit,MUST,Joe,2,TODO
T1346,Vel ut qui ipsam eligendi nihil vero iste sequi vero minus,MUST,Joe,1,DONE
T1347,Repudiandae minima deleniti beatae in autem,WISH,Joe,10,DONE
T1348,Harum dolores saepe harum,WISH,Joe,2,DONE
T1349,Accusamus aliquam harum,SHOULD,Natasha,2,DONE
T1350,Inventore atque,COULD,Natasha,1,DONE
T1351,Maxime necessitatibus deserunt accusantium velit dolorum quia adipisci odio,WISH,Natasha,2,DONE
T1352,Cumque sint non aliquam hic alias quia impedit,COULD,Mike,2,DOING
T1353,Laborum labore eius,SHOULD,Joe,2,DONE
T1354,Vel rerum accusamus rem autem enim,WISH,Joe,2,DONE
T1355,Ab,COULD,Joe,1,DONE
T1356,Similique eos eligendi,COULD,Joe,10,DONE
T1357,Cum iusto aperiam dolores modi facere praesentium omnis qui rem,COULD,Mike,1,DONE
T1358,Ea eos velit voluptates illo,COULD,Mike,15,DONE
T1359,Ea totam eos,WISH,Natasha,15,DONE
T1360,Quasi distinctio repudiandae at,SHOULD,Joe,1,TODO
T1361,Officiis adipisci consectetur facere numquam nihil et ratione,WISH,Joe,15,DONE
T1362,Facilis corrupti itaque minima eos nobis inventore,WISH,Joe,10,DONE
T1363,Eius deleniti,SHOULD,Mike,2,DONE
T1364,Sapiente deserunt magnam,MUST,Natasha,10,DONE
T1365,Eligendi dolorem aperiam,SHOULD,Joe,10,DONE
T1366,Iste excepturi consequatur consequuntur,WISH,Mike,10,DONE
T1367,Adipisci consequatur molestias,WISH,Joe,1,DONE
T1368,Architecto fugit eos nam,COULD,Joe,2,DONE
T1369,Molestias magnam at,SHOULD,Mike,2,DONE
T1370,Adipisci voluptatem ducimus,SHOULD,Joe,10,DONE
T1371,Repudiandae eius recusandae tempore ea non,COULD,Joe,10,DONE
T1372,Alias laudantium placeat asperiores,WISH,Natasha,2,DONE
T1373,Enim assumenda velit,COULD,Natasha,7,DONE
T1374,Veritatis eum iure tempore totam quia aperiam optio cumque,WISH,Joe,1,DONE
T1375,Ex dolorem distinctio asperiores voluptates,SHOULD,Joe,1,DONE
T1376,Impedit doloribus tempora eligendi praesentium animi,COULD,Joe,10,TODO
T1377,Quis quod eos nostrum dolore,WISH,Joe,10,TODO
T1378,Occaecati veniam atque dolorem ipsum,WISH,Joe,2,DONE
T1379,Minima repellat officia quibusdam odio,WISH,Natasha,2,DONE
T1380,Aut beatae deleniti,COULD,Mike,15,DONE
T1381,Excepturi nisi accusamus assumenda possimus,MUST,Joe,1,DONE
T1382,Ducimus ad aspernatur repudiandae perferendis vero dicta repellendus,COULD,Natasha,2,DOING
T1383,Voluptas doloribus,SHOULD,Mike,2,DONE
T1384,Rerum atque repellat est molestias consequuntur,COULD,Natasha,10,TODO
T1385,Sapiente at,SHOULD,Joe,10,DONE
T1386,Occaecati voluptatem maxime praesentium nisi ipsam facere nisi,WISH,Natasha,7,DOING
T1387,Cum voluptate vel voluptatum,WISH,Joe,7,DONE
T1388,Voluptate at deleniti,WISH,Joe,10,TODO
T1389,Doloremque rem incidunt culpa earum,COULD,Joe,3,DOING
T1390,Et libero quam minus alias sapiente et expedita maxime ea,COULD,Joe,7,DONE
T1391,Impedit minus nihil illo eius explicabo tenetur aut fugiat,MUST,Joe,7,DOING
T1392,Deleniti eligendi,COULD,Joe,15,DONE
T1393,Minima voluptate quibusdam recusandae delectus pariatur,COULD,Joe,7,DONE
T1394,Harum officia quis nostrum facilis,COULD,Joe,1,DONE
T1395,Deleniti excepturi fugit iste provident,COULD,Joe,10,TODO
T1396,Odio doloribus,WISH,Mike,4,DONE
T1397,Inventore voluptate doloremque libero,COULD,Joe,7,DONE
T1398,Similique aperiam,SHOULD,Joe,10,DONE
T1399,Dolorem modi vel ipsam voluptatibus autem excepturi perspiciatis soluta,MUST,Natasha,10,DONE
T1400,Quae minima perspiciatis quidem cum aliquid,SHOULD,Natasha,1,TODO
T1401,Magnam inventore perferendis,COULD,Joe,2,DOING
T1402,Qui reiciendis autem vitae earum aperiam sequi debitis in maxime molestiae,SHOULD,Joe,2,DONE
T1403,Fuga repellendus quis corporis aliquam,MUST,Joe,1,DONE
T1404,Delectus iste voluptates esse fugit officiis officia dolores reprehenderit voluptatum,COULD,Natasha,2,DONE
T1405,Numquam delectus recusandae dolorum soluta dolore vel tempore,MUST,Natasha,7,DONE
T1406,Vel placeat porro natus quae similique,WISH,Joe,10,TODO
T1407,Nemo cumque dolor cumque magni,COULD,Joe,3,DOING
T1408,At vel quos,WISH,Joe,15,DONE
T1409,Eius eligendi,COULD,Joe,2,TODO
T1410,Aliquam cupiditate ab quas voluptate cupiditate dicta minima corporis voluptas,WISH,Natasha,7,DONE
T1411,Quibusdam molestiae harum dicta officiis ratione,MUST,Joe,10,DONE
T1412,Voluptatibus provident atque cupiditate,COULD,Natasha,15,DONE
T1413,Ducimus totam quidem dicta ipsam unde corrupti,MUST,Mike,7,DONE
T1414,Enim cumque,COULD,Natasha,4,DONE
T1415,Laudantium fuga deleniti quasi molestias nostrum consequuntur dignissimos magni,WISH,Joe,1,DONE
T1416,Suscipit dolores ratione nisi ipsam,COULD,Mike,2,TODO
T1417,Earum reiciendis eum iusto repellat at,SHOULD,Mike,1,DOING
T1418,Perspiciatis libero error doloremque deserunt dignissimos at,COULD,Joe,1,DONE
T1419,Blanditiis repellat reiciendis magnam nemo perferendis adipisci repellat ratione quos porro,COULD,Joe,15,DOING
T1420,Ipsam est neque quasi et quisquam mollitia,SHOULD,Joe,15,DONE
T1421,Eum nostrum doloribus ratione,COULD,Mike,2,DONE
