id,name,priority,who,time,status
T6030,Maxime veritatis ullam aliquid aut nostrum,WISH,Joe,2,DONE
T6031,Saepe aperiam quo sunt aspernatur reprehenderit a rerum nostrum,WISH,Mike,2,DONE
T6032,Aspernatur impedit quis quaerat accusamus,WISH,Mike,10,DONE
T6033,Quasi magnam maiores vero cupiditate rem adipisci maxime ipsa,WISH,Joe,7,DONE
T6034,Adipisci,WISH,Natasha,10,DONE
T6035,Commodi dicta veritatis sint,WISH,Mike,7,DONE
T6036,Praesentium aliquam nesciunt molestias dignissimos,WISH,Joe,1,DONE
T6037,Vero omnis nihil similique deserunt,COULD,Joe,10,DOING
T6038,Facilis eius enim consequatur eveniet,COULD,Joe,7,DOING
T6039,Dicta vel iure voluptatem corrupti,COULD,Natasha,15,DONE
T6040,Dignissimos repellendus,WISH,Mike,15,DONE
T6041,Nemo quam odio doloremque,SHOULD,Joe,10,DONE
T6042,Quis vitae doloremque illo rem,WISH,Natasha,1,DOING
T6043,Error repellat aliquid non unde,SHOULD,Mike,10,DONE
T6044,Est minima iure cumque soluta alias,COULD,Mike,15,DONE
T6045,Corporis cumque ratione excepturi reiciendis aut earum perspiciatis,SHOULD,Natasha,15,DONE
T6046,Accusantium beatae enim provident ducimus,SHOULD,Joe,10,TODO
T6047,Totam tenetur eius,MUST,Natasha,2,DONE
T6048,Animi officia perspiciatis provident est quasi,COULD,Mike,15,DONE
T6049,Ea iste accusantium natus labore nobis,COULD,Natasha,10,DONE
T6050,Libero ex odit saepe voluptates natus alias rem,COULD,Joe,1,DONE
T6051,Ullam odit iusto libero laudantium expedita,COULD,Mike,10,DONE
T6052,Fugiat illum vel nam unde,COULD,Joe,10,TODO
T6053,Qui accusantium,COULD,Joe,1,DOING
T6054,Architecto vitae repudiandae sint minima eum tempore cum,SHOULD,Natasha,10,DONE
T6055,Voluptatem dolorum iusto at corporis vel eaque,COULD,Mike,10,DONE
T6056,Maiores eum dolores nisi fugiat,COULD,Joe,10,DONE
T6057,Commodi quisquam assumenda maiores omnis cum expedita,COULD,Joe,10,DONE
T6058,Quis doloremque quia error,COULD,Joe,10,DONE
T6059,Tempore sunt quasi distinctio autem mollitia,WISH,Mike,10,DONE
T6060,Minima mollitia vero,SHOULD,Joe,15,DONE
T6061,Deleniti et dolorem doloremque debitis est nam quia quod,SHOULD,Mike,10,DONE
T6062,Natus laborum numquam ratione molestiae,COULD,Joe,2,TODO
T6063,Eius nihil ducimus magnam maiores,COULD,Joe,1,DONE
T6064,Molestiae omnis amet fuga doloremque neque,WISH,Mike,10,TODO
T6065,Est fugit tempora esse,WISH,Mike,15,TODO
T6066,Veniam praesentium,COULD,Natasha,7,DONE
T6067,Magnam aut animi nemo,COULD,Mike,2,DONE
T6068,Consectetur reiciendis ut sed architecto placeat,COULD,Mike,2,DONE
T6069,Dicta nesciunt corrupti dolorum doloremque blanditiis voluptatum,COULD,Joe,10,DONE
T6070,Atque nesciunt libero similique voluptates,COULD,Natasha,10,DONE
T6071,Error ex officia tenetur assumenda quis impedit et,MUST,Joe,2,DOING
T6072,Tempore asperiores dolorem nesciunt possimus voluptatum laborum,COULD,Natasha,2,DONE
T6073,Perferendis laudantium harum nulla ut quisquam,WISH,Mike,1,TODO
T6074,Asperiores nesciunt aperiam ullam eveniet maiores,COULD,Joe,15,TODO
T6075,Consequuntur culpa delectus rem minima quasi possimus reprehenderit delectus nesciunt,WISH,Mike,2,TODO
T6076,Sed sunt ratione totam occaecati cum,WISH,Joe,7,DOING
T6077,Tenetur laboriosam asperiores accusamus saepe,COULD,Natasha,2,DOING
T6078,Quo earum voluptatem provident ipsam,COULD,Joe,15,DONE
T6079,Praesentium atque eos,COULD,Joe,15,DONE
T6080,Consequatur quibusdam ipsam ratione,WISH,Mike,7,DOING
T6081,Corporis recusandae,COULD,Mike,15,DONE
T6082,Veniam animi quasi,COULD,Natasha,1,DONE
T6083,Architecto distinctio incidunt tempore delectus voluptate at vitae minus,WISH,Joe,2,TODO
T6084,Est quidem perferendis,SHOULD,Joe,2,TODO
T6085,Quaerat nihil accusantium nihil,COULD,Joe,10,DONE
T6086,Illum temporibus quis maiores sunt,COULD,Mike,1,DONE
T6087,Hic deleniti sunt ab dolores,COULD,Joe,10,TODO
T6088,Pariatur dolore ut neque incidunt,COULD,Mike,1,DOING
T6089,Quasi pariatur enim tenetur nam totam,COULD,Natasha,15,TODO
T6090,Consequuntur rerum quas veritatis quam,COULD,Natasha,7,DONE
T6091,Saepe nihil soluta eius fugit molestias dolor ad,SHOULD,Joe,15,DONE
T6092,Sed ipsa nulla inventore officiis aliquam,SHOULD,Joe,15,DOING
T6093,Totam quam voluptatem,WISH,Joe,10,TODO
T6094,Quas explicabo explicabo,WISH,Joe,10,DONE
T6095,Adipisci assumenda amet facere,WISH,Mike,1,DONE
T6096,Cupiditate repellendus perferendis quas soluta aliquid impedit incidunt est assumenda,SHOULD,Natasha,2,DONE
T6097,Recusandae distinctio eius sit eveniet,WISH,Mike,10,DONE
T6098,Non ad enim corporis vitae nisi unde distinctio qui id,WISH,Mike,1,DONE
T6099,Veritatis,WISH,Mike,2,TODO
T6100,Soluta consequatur ut assumenda,SHOULD,Joe,10,DOING
T6101,Ex quae corrupti cumque maxime libero,SHOULD,Joe,15,DONE
T6102,Reprehenderit esse tenetur,COULD,Joe,15,DONE
T6103,Velit cumque hic,COULD,Joe,10,DONE
T6104,Sint iste doloremque porro repellendus ipsam,MUST,Mike,15,DONE
T6105,In possimus,COULD,Natasha,1,DONE
T6106,Deleniti animi quas aut illum,SHOULD,Joe,15,DONE
T6107,Sed fuga omnis,WISH,Mike,2,TODO
T6108,Sequi reiciendis non sapiente,SHOULD,Joe,7,DONE
T6109,Deserunt amet ullam doloremque nostrum eum quod animi,COULD,Mike,10,DOING
T6110,Aliquid sequi eveniet eveniet ipsum voluptatem,SHOULD,Joe,10,DONE
T6111,Deserunt eius vitae,COULD,Natasha,10,DONE
T6112,Inventore quia eligendi atque eligendi est,WISH,Mike,15,DONE
T6113,Cumque similique asperiores iure,MUST,Natasha,15,DONE
T6114,Iusto deleniti expedita sapiente quasi,COULD,Natasha,15,DONE
T6115,Fuga iusto aliquam iusto,WISH,Joe,10,DONE
T6116,Odit atque maiores,WISH,Joe,2,TODO
T6117,Vitae modi optio labore,COULD,Mike,15,TODO
T6118,Provident nesciunt consectetur reiciendis,MUST,Natasha,2,DONE
T6119,Atque laudantium ratione possimus,WISH,Joe,10,DOING
T6120,Officia cupiditate ratione,SHOULD,Joe,2,TODO
T6121,Autem architecto maiores expedita labore accusantium voluptatum maiores ipsam,COULD,Joe,10,TODO
T6122,Aliquid perferendis,COULD,Natasha,2,DONE
T6123,Perspiciatis eos optio amet quam accusamus natus dolorem iusto accusamus,WISH,Joe,1,DONE
T6124,Asperiores necessitatibus adipisci minus dignissimos repellat voluptate tempore,WISH,Joe,2,TODO
T6125,Voluptatem impedit sit minima voluptatem aspernatur qui,WISH,Joe,2,DONE
T6126,Sapiente repudiandae exercitationem,COULD,Natasha,10,DONE
T6127,Molestias quidem est occaecati,SHOULD,Natasha,1,DONE
T6128,Voluptatum fuga magnam,WISH,Joe,10,DONE
T6129,Ad mollitia consequuntur,COULD,Mike,10,DONE
T6130,Ab illo enim accusamus et harum,COULD,Joe,10,DONE
T6131,Soluta cum et,COULD,Joe,10,DONE
T6132,Optio recusandae facere odio expedita nesciunt ut voluptatum recusandae,COULD,Natasha,7,DONE
T6133,Soluta laudantium non voluptatum sit quos ipsum accusantium temporibus voluptas quam,MUST,Joe,1,DONE
T6134,Possimus,COULD,Joe,15,DONE
T6135,Labore odio vitae perspiciatis sed fuga voluptas,COULD,Joe,2,TODO
T6136,Alias laboriosam deserunt nesciunt,COULD,Joe,2,DONE
T6137,Debitis nostrum exercitationem magni quasi,COULD,Natasha,1,DONE
T6138,Eum aut dignissimos cum perferendis sit earum molestias exercitationem temporibus,SHOULD,Joe,10,DONE
T6139,Sunt occaecati possimus ad autem totam,SHOULD,Natasha,2,DONE
T6140,Soluta possimus officiis tempore distinctio distinctio ratione adipisci consequuntur,COULD,Joe,10,TODO
T6141,Molestias a reprehenderit fuga itaque esse,WISH,Natasha,10,DONE
T6142,Non iusto sint,COULD,Joe,15,DONE
T6143,Nostrum assumenda ratione eum numquam expedita ipsam,WISH,Mike,7,DONE
T6144,Tenetur quam laudantium magnam quibusdam,SHOULD,Natasha,2,TODO
T6145,Ad consectetur dicta quos nam,WISH,Joe,2,DONE
T6146,Sunt aliquid ex soluta placeat a libero excepturi sunt,SHOULD,Natasha,10,DOING
T6147,Doloremque deserunt deserunt tenetur magnam aspernatur quod,WISH,Joe,2,DONE
T6148,Debitis voluptatibus,SHOULD,Joe,7,DONE
T6149,Soluta,COULD,Joe,1,DONE
T6150,Reprehenderit animi cupiditate,COULD,Joe,1,DONE
T6151,Tempore reprehenderit sequi voluptas iusto dignissimos optio molestiae aliquid voluptas,WISH,Joe,10,DONE
T6152,Tempora culpa sunt nihil repellendus,MUST,Joe,10,DONE
T6153,Qui voluptatibus aliquid culpa velit consectetur,COULD,Joe,1,DOING
T6154,Delectus commodi temporibus est occaecati dolore ullam,WISH,Mike,10,DONE
T6155,Quis exercitationem fugiat,COULD,Mike,15,DONE
T6156,Distinctio repudiandae odit velit eveniet et,COULD,Mike,10,DONE
T6157,Harum distinctio dolorum cumque debitis perferendis debitis et labore quidem,COULD,Joe,10,TODO
T6158,Magni reprehenderit in,COULD,Joe,2,DONE
T6159,Ex quibusdam ipsum nisi reiciendis tempore tenetur,WISH,Natasha,2,DONE
T6160,Aut veritatis explicabo sapiente provident non maiores,SHOULD,Joe,15,DONE
T6161,Ex sapiente repudiandae consectetur inventore ullam assumenda,WISH,Mike,15,DONE
T6162,Natus minima aspernatur facere officia consequatur,WISH,Joe,10,DOING
T6163,Totam tempora vel rem voluptates reiciendis,COULD,Mike,15,DONE
T6164,Eum corporis laborum totam soluta quaerat,WISH,Mike,10,DONE
T6165,Est omnis magnam soluta,MUST,Joe,2,DONE
T6166,Voluptatem consequuntur,SHOULD,Natasha,7,DONE
T6167,Numquam nobis suscipit est consectetur,WISH,Mike,10,DONE
T6168,Aut cum quam dolorem voluptate,COULD,Joe,10,DONE
T6169,Rem explicabo,COULD,Joe,10,TODO
T6170,Voluptates quos occaecati iusto fuga,WISH,Natasha,2,DONE
T6171,Nulla doloremque tenetur soluta cum modi,COULD,Joe,15,DONE
T6172,Dolorum maiores voluptatum architecto nam,COULD,Natasha,10,DONE
T6173,Eaque facere ea magnam repellat,COULD,Mike,10,DOING
T6174,Quia esse nisi pariatur tenetur,SHOULD,Natasha,10,DOING
T6175,Non optio sapiente provident corrupti aliquid maiores quos soluta,WISH,Mike,1,DONE
T6176,Fugit quia a labore assumenda,SHOULD,Joe,15,DONE
T6177,Consequuntur aliquam,WISH,Joe,1,DONE
T6178,Alias repellat sequi voluptatibus ex repellendus accusantium rerum laboriosam,WISH,Mike,15,DONE
T6179,Repudiandae ullam odio in eos deserunt quae,COULD,Joe,10,TODO
T6180,Eaque quisquam excepturi,WISH,Mike,10,DONE
T6181,Adipisci aspernatur ex itaque officia exercitationem,COULD,Joe,15,TODO
T6182,Rerum corporis neque culpa esse consequuntur hic incidunt deleniti,COULD,Joe,15,DONE
T6183,Magnam libero architecto tenetur voluptatem quibusdam,WISH,Mike,10,TODO
T6184,Perspiciatis eaque repudiandae doloribus,COULD,Joe,1,DONE
T6185,Nam deserunt nihil,WISH,Natasha,2,DONE
T6186,Error magni quia repudiandae,COULD,Joe,7,DONE
T6187,Doloribus harum quaerat explicabo consequatur hic sit necessitatibus ea veritatis,WISH,Mike,7,DONE
T6188,Cupiditate expedita ab assumenda laboriosam consequatur facere doloribus,WISH,Natasha,2,TODO
T6189,Nisi delectus voluptatum,SHOULD,Natasha,10,DONE
T6190,Molestias aliquam molestias,SHOULD,Natasha,2,TODO
T6191,Sequi quaerat qui deserunt quibusdam,COULD,Joe,10,DONE
T6192,Non at id ab provident,WISH,Natasha,10,TODO
T6193,Rerum aliquid nulla magnam labore itaque,SHOULD,Joe,15,TODO
T6194,Numquam eum eius ad facilis occaecati,COULD,Natasha,15,DONE
T6195,Quis nostrum saepe delectus cum optio in officia,COULD,Joe,10,DONE
T6196,Fugiat voluptatum dolore odio nulla dicta nesciunt aliquam quis,SHOULD,Mike,15,TODO
T6197,Sunt aut rerum odit eos repudiandae consequuntur cupiditate exercitationem,MUST,Joe,4,DONE
T6198,Voluptatum aliquid adipisci quas laudantium perferendis,COULD,Mike,2,DONE
T6199,Tempora dolores atque repellendus,WISH,Joe,10,TODO
T6200,Illum esse velit a assumenda animi necessitatibus deleniti delectus,COULD,Joe,3,DONE
T6201,Veniam quisquam dolore molestias,COULD,Joe,2,DONE
T6202,Beatae officiis id doloremque quo numquam,SHOULD,Mike,10,DONE
T6203,In magnam delectus aliquam quae iure est minima reprehenderit,SHOULD,Joe,2,DONE
T6204,Ea harum minima in vel,WISH,Mike,10,DONE
T6205,Labore odio sapiente corporis,COULD,Joe,2,DONE
T6206,Porro dicta ea,WISH,Natasha,10,DONE
T6207,Distinctio similique impedit maiores,MUST,Natasha,10,DONE
T6208,Ex doloribus adipisci corporis mollitia neque numquam,WISH,Mike,10,DONE
T6209,Repudiandae ipsum fugiat,WISH,Mike,15,DOING
T6210,Occaecati ea quaerat quisquam,SHOULD,Joe,10,DONE
T6211,Officiis ipsa odio,COULD,Joe,10,TODO
T6212,Perferendis amet pariatur animi velit,SHOULD,Joe,1,DONE
T6213,Quaerat,COULD,Joe,7,DONE
T6214,Assumenda et animi,WISH,Natasha,15,DONE
T6215,Eius asperiores quibusdam commodi,COULD,Natasha,10,DOING
T6216,Accusamus sint,COULD,Joe,10,DOING
T6217,Optio sint porro,COULD,Joe,2,DONE
T6218,Libero architecto ullam quidem voluptates dolor,WISH,Natasha,2,DONE
T6219,Pariatur repudiandae nam quia,SHOULD,Mike,10,DONE
T6220,Fugiat unde,COULD,Natasha,3,DONE
T6221,Dolore eaque ipsum vel aut maiores ipsa optio,COULD,Joe,2,DONE
T6222,Similique ut tenetur unde culpa cumque laboriosam dignissimos dolor,COULD,Natasha,7,DONE
T6223,Sapiente ea non rerum illo mollitia,COULD,Joe,2,TODO
T6224,Ea suscipit tenetur natus labore,SHOULD,Joe,2,DOING
T6225,Quidem maxime quo commodi aperiam cum sint voluptatum rerum,SHOULD,Natasha,1,DONE
T6226,Accusamus possimus,COULD,Mike,2,TODO
T6227,Eveniet quam asperiores dolor,COULD,Mike,7,DONE
T6228,Est quia quidem quaerat beatae,SHOULD,Natasha,1,DONE
T6229,Commodi voluptate consequuntur,WISH,Mike,2,DONE
T6230,Fuga assumenda corporis,WISH,Natasha,2,DONE
T6231,Fugiat hic beatae iure ex nemo sint aut adipisci itaque,WISH,Natasha,1,DONE
T6232,Repellendus ipsum,COULD,Joe,2,TODO
T6233,Dignissimos laborum quaerat,COULD,Mike,1,DONE
T6234,Sed nulla,SHOULD,Joe,2,DONE
T6235,Quos eius odio,COULD,Joe,2,DONE
T6236,Exercitationem veniam natus culpa suscipit delectus dignissimos,MUST,Mike,2,DONE
T6237,Cupiditate quisquam autem animi magnam sed,WISH,Joe,10,TODO
T6238,Doloribus perferendis unde ad,COULD,Joe,2,DONE
T6239,Dignissimos totam sit consequatur,COULD,Natasha,1,DONE
T6240,Optio provident minus nulla,COULD,Natasha,10,DONE
T6241,Quo saepe,MUST,Joe,10,DONE
T6242,Cumque non magnam corporis asperiores necessitatibus cupiditate labore,WISH,Mike,2,DONE
T6243,Quasi dolorem quasi nemo,SHOULD,Joe,7,TODO
T6244,Officiis magnam debitis quam explicabo dolore eius fugiat,WISH,Mike,10,DONE
T6245,Nemo adipisci ipsam harum optio,WISH,Mike,3,DONE
T6246,Reiciendis hic consectetur ipsa tempora delectus sunt ea mollitia,SHOULD,Joe,2,TODO
T6247,Aspernatur dolorem,SHOULD,Joe,1,DONE
T6248,Quo nulla facilis enim deleniti mollitia adipisci delectus tempora,COULD,Joe,10,DONE
T6249,Sint unde amet inventore magnam nesciunt dolore doloremque alias,SHOULD,Natasha,7,TODO
T6250,Perspiciatis,MUST,Mike,10,DONE
T6251,Laborum suscipit a fugit ea,WISH,Joe,10,DONE
T6252,Repudiandae laboriosam ullam,SHOULD,Joe,15,DONE
T6253,Error perspiciatis,SHOULD,Joe,10,DOING
T6254,Magni ad ipsam vitae dignissimos,WISH,Joe,2,DONE
T6255,Repudiandae consectetur dicta,WISH,Joe,15,TODO
T6256,Doloremque quibusdam veritatis voluptate repudiandae facilis doloribus praesentium veritatis,WISH,Joe,15,DOING
T6257,Cumque temporibus aliquam nam ipsum,WISH,Joe,10,DONE
T6258,Placeat fuga occaecati placeat ab culpa iure,WISH,Natasha,10,DONE
T6259,Placeat doloremque veniam ut earum,COULD,Joe,10,DONE
T6260,Exercitationem quisquam,WISH,Joe,15,DOING
T6261,Voluptates officia impedit quis fuga error provident veritatis dolorum aliquid,WISH,Joe,15,TODO
T6262,Dolor vel magnam vitae exercitationem ex autem laboriosam,WISH,Natasha,15,DONE
T6263,Nemo incidunt dolores reprehenderit eius,WISH,Joe,10,TODO
T6264,Ratione harum omnis eos alias,MUST,Joe,4,DONE
T6265,Impedit ipsa illo,COULD,Joe,1,DONE
T6266,Quasi tempora commodi unde nemo eius at tenetur consequatur,COULD,Joe,7,DONE
T6267,Veritatis vel illo,WISH,Joe,10,TODO
T6268,Tenetur ea vitae quis,COULD,Joe,15,DONE
T6269,Illo natus rem sit,COULD,Natasha,3,TODO
T6270,Consequatur voluptatum,MUST,Mike,10,TODO
T6271,Fuga quam,COULD,Mike,1,TODO
T6272,Facere quos reprehenderit similique ipsum eveniet,WISH,Joe,1,TODO
T6273,Enim inventore laboriosam quibusdam ipsam,WISH,Natasha,10,DONE
T6274,Illum distinctio a debitis ex,WISH,Joe,15,TODO
T6275,Corporis beatae autem,COULD,Joe,2,DONE
T6276,Consectetur natus quasi laborum itaque dolorum modi expedita nisi,WISH,Natasha,2,TODO
T6277,Molestiae dolor,SHOULD,Joe,2,DONE
T6278,Perspiciatis quas voluptas debitis aliquam eum,SHOULD,Joe,1,TODO
T6279,Nisi nulla recusandae quos,MUST,Natasha,10,DONE
T6280,Quisquam quibusdam ratione officia similique ipsam earum,COULD,Joe,15,DONE
T6281,Praesentium cupiditate recusandae,COULD,Natasha,15,DONE
T6282,Suscipit esse in illum aut vitae exercitationem doloribus molestias,SHOULD,Joe,1,TODO
T6283,Amet similique eligendi accusamus,COULD,Joe,2,DOING
T6284,Reprehenderit porro iure ratione deserunt quia sed earum,COULD,Natasha,1,DONE
T6285,Accusamus quibusdam voluptatum quod,COULD,Natasha,2,DONE
T6286,Vitae nulla ex alias,COULD,Joe,10,DONE
T6287,Inventore asperiores,SHOULD,Joe,15,DONE
T6288,Veniam expedita natus reprehenderit,SHOULD,Natasha,1,DONE
T6289,Delectus sequi at doloribus tenetur omnis,COULD,Joe,2,DONE
T6290,Amet libero eaque eius molestiae qui laborum eos nesciunt similique beatae,COULD,Natasha,10,DONE
T6291,Repellat incidunt officia dicta occaecati,COULD,Joe,1,DONE
T6292,Dolore eveniet placeat veritatis sit vero veniam,WISH,Joe,2,TODO
T6293,Sequi maxime sit deserunt,COULD,Natasha,1,DONE
T6294,Minus rem provident earum voluptatibus ipsa,COULD,Joe,15,DONE
T6295,Recusandae nobis cupiditate,COULD,Joe,1,TODO
T6296,Nobis laboriosam cupiditate ad et tempore,COULD,Natasha,1,DOING
T6297,Quaerat voluptatem,COULD,Joe,7,TODO
T6298,Beatae accusantium numquam,WISH,Joe,15,DONE
T6299,Accusantium aut velit non ut deserunt assumenda sit rerum,COULD,Joe,10,DOING
T6300,Magnam molestias voluptatibus,SHOULD,Joe,7,TODO
T6301,Reprehenderit temporibus consequatur,COULD,Joe,2,DONE
T6302,Rerum suscipit aut consectetur repellat voluptates,COULD,Joe,1,DONE
T6303,Earum porro dolores tempore veritatis ut,MUST,Mike,10,DOING
T6304,Placeat dolore soluta occaecati fuga,WISH,Joe,2,DONE
T6305,Necessitatibus deserunt expedita,WISH,Joe,10,DONE
T6306,Esse dolorum praesentium corporis incidunt aspernatur,WISH,Joe,1,DONE
T6307,Animi incidunt alias,WISH,Joe,15,DONE
T6308,Libero nemo,COULD,Joe,2,DONE
T6309,Repellendus quod sint accusantium deleniti quam quidem occaecati nesciunt tempora,WISH,Joe,10,DONE
T6310,Veritatis sed voluptates ut minima beatae ut necessitatibus expedita quae ipsum,WISH,Natasha,1,DONE
T6311,Modi quibusdam error sed aspernatur,SHOULD,Joe,7,DONE
T6312,Quia vero,MUST,Joe,15,TODO
T6313,Perspiciatis ex ad libero numquam commodi sequi,COULD,Mike,2,DONE
T6314,Magni saepe ea labore corrupti ut,MUST,Mike,10,DONE
T6315,Nam amet eos fugiat incidunt ut excepturi cupiditate,COULD,Mike,1,DONE
T6316,Eligendi eveniet fuga aperiam natus,WISH,Joe,10,DONE
T6317,Aliquam sit libero odio cum,WISH,Joe,10,DONE
T6318,Aliquam hic illo commodi perspiciatis perspiciatis,COULD,Mike,10,DONE
T6319,Molestias adipisci assumenda beatae praesentium,WISH,Joe,15,DONE
T6320,Maiores dolorum facilis animi,SHOULD,Joe,15,DONE
T6321,Ea illo esse libero,WISH,Natasha,10,DONE
T6322,Aliquam necessitatibus eum sunt,COULD,Mike,1,DONE
T6323,Ducimus sequi mollitia,WISH,Mike,10,DONE
T6324,Quasi libero cum officiis,SHOULD,Mike,2,TODO
T6325,Fugit nemo itaque commodi in eum,COULD,Mike,15,TODO
T6326,Rem optio adipisci,COULD,Joe,2,DONE
T6327,Cum veritatis aliquid accusamus iusto,COULD,Mike,1,DONE
T6328,Earum voluptatibus beatae natus possimus dignissimos nam,COULD,Joe,10,TODO
T6329,Reprehenderit modi distinctio assumenda assumenda,COULD,Joe,10,DONE
T6330,Cumque distinctio consequatur minus,COULD,Joe,2,DONE
T6331,Necessitatibus suscipit non voluptatem,WISH,Mike,10,DONE
T6332,Quia expedita sed optio,COULD,Joe,2,DONE
T6333,Quos molestiae magni corrupti consequatur similique quod,COULD,Joe,10,DONE
T6334,Nisi voluptatum hic adipisci ut delectus,WISH,Natasha,7,DONE
T6335,Similique,WISH,Joe,10,DONE
T6336,Repellendus eos consequuntur tempora dolore expedita inventore culpa adipisci distinctio,WISH,Joe,10,TODO
T6337,Iusto aspernatur voluptates atque deserunt soluta,WISH,Mike,10,TODO
T6338,Occaecati sequi corrupti labore,COULD,Joe,1,TODO
T6339,Beatae,WISH,Joe,10,TODO
T6340,Consectetur dicta,COULD,Joe,1,DONE
T6341,Est veniam voluptas voluptatem,WISH,Mike,7,DONE
T6342,Cum ratione maxime repudiandae rem,WISH,Natasha,1,TODO
T6343,Doloribus harum ex non,COULD,Natasha,15,DONE
T6344,Facere saepe perferendis laboriosam,WISH,Mike,10,TODO
T6345,Sapiente magni aliquam,COULD,Joe,7,TODO
T6346,Distinctio consectetur ad quaerat velit saepe odio modi eaque,WISH,Natasha,1,DONE
T6347,Rem,COULD,Joe,1,TODO
T6348,Dolorum omnis doloremque,WISH,Joe,10,DONE
T6349,Sequi libero,COULD,Joe,7,DONE
T6350,Consectetur nisi excepturi totam tempore,WISH,Joe,15,TODO
T6351,Quaerat occaecati neque quidem,SHOULD,Joe,1,DONE
T6352,Fuga fugiat temporibus,SHOULD,Natasha,2,DOING
T6353,Possimus accusantium,WISH,Natasha,2,DOING
T6354,Incidunt accusantium exercitationem eum veritatis,COULD,Natasha,10,DOING
T6355,Occaecati tempore illum voluptatum autem nihil,SHOULD,Joe,7,DONE
T6356,Quaerat veniam in animi,SHOULD,Joe,2,DONE
T6357,Qui eligendi fugiat quod aperiam voluptatibus illum magni,COULD,Joe,2,DONE
T6358,Voluptas in dolorem alias inventore explicabo aliquid architecto fuga,WISH,Joe,4,DONE
T6359,Ut error nemo,COULD,Mike,2,TODO
T6360,Iure eum commodi et illo,SHOULD,Natasha,1,DONE
T6361,Enim tempore nostrum,COULD,Joe,2,DONE
T6362,Doloribus nobis odio ex quae aliquid labore,WISH,Natasha,15,DONE
T6363,Quae at voluptas magnam labore repellat,WISH,Joe,10,TODO
T6364,Esse velit nihil ratione exercitationem mollitia facere,COULD,Joe,1,DONE
T6365,Illum fugiat voluptatum atque iste facilis,WISH,Mike,15,DONE
T6366,Numquam deleniti dolorum,SHOULD,Mike,10,DOING
T6367,Minima ratione recusandae,SHOULD,Joe,7,DONE
T6368,Velit magnam sequi,WISH,Natasha,10,DONE
T6369,Dicta cum iusto,MUST,Natasha,10,DONE
T6370,Exercitationem eum dolores,WISH,Joe,15,DONE
T6371,Iusto quas ratione recusandae modi hic,MUST,Natasha,7,TODO
T6372,Sapiente nobis non qui molestias sit perferendis,SHOULD,Joe,1,TODO
T6373,Doloribus saepe sunt neque,COULD,Natasha,1,TODO
T6374,Incidunt accusantium numquam,MUST,Natasha,2,DONE
T6375,Laboriosam omnis dolores sunt veritatis eum voluptatem,SHOULD,Natasha,15,DONE
T6376,Placeat cumque perferendis id molestias reprehenderit eaque expedita delectus,WISH,Natasha,15,DONE
T6377,At cumque incidunt beatae,COULD,Mike,1,DONE
T6378,Facilis reiciendis similique voluptatum,COULD,Mike,7,DONE
T6379,Ratione accusantium nam ea quae amet vitae,COULD,Natasha,10,DONE
T6380,Culpa nam maxime laboriosam placeat perspiciatis repudiandae debitis,WISH,Natasha,15,DONE
T6381,Asperiores nobis pariatur quae,WISH,Natasha,7,DONE
T6382,Animi blanditiis,WISH,Natasha,2,DONE
T6383,Distinctio ipsa quidem ipsam reprehenderit,WISH,Natasha,2,DONE
T6384,Eius illo fuga aliquam,WISH,Natasha,10,DONE
T6385,Deleniti laboriosam magni,SHOULD,Natasha,15,DONE
T6386,Dolore accusamus maiores sequi maxime saepe perferendis,SHOULD,Joe,2,TODO
T6387,Quo ipsum suscipit aliquam corrupti quibusdam,COULD,Joe,15,DONE
T6388,Aliquid consequuntur dolore,COULD,Natasha,2,TODO
T6389,Ipsum quod quas labore aliquam ab,WISH,Joe,1,DONE
T6390,Ad eveniet hic voluptatum officia,COULD,Joe,7,DONE
T6391,Ratione porro cumque accusantium sapiente deserunt impedit sed,WISH,Joe,4,DONE
T6392,Sit optio asperiores impedit similique provident quidem asperiores sint veniam ab,COULD,Natasha,15,TODO
T6393,Reprehenderit suscipit suscipit iusto,WISH,Joe,1,DONE
T6394,Voluptatem similique nulla,SHOULD,Joe,1,DONE
T6395,Quo non itaque voluptate aperiam,WISH,Joe,2,DONE
T6396,Itaque error porro nihil in autem ut iste autem qui,SHOULD,Natasha,1,DONE
T6397,Fuga voluptates,COULD,Joe,2,TODO
T6398,Ipsa molestiae minus aliquid quae,WISH,Joe,1,DONE
T6399,Pariatur enim accusamus perferendis officia amet hic,COULD,Joe,3,DONE
T6400,Quasi quasi necessitatibus cum dignissimos error,SHOULD,Natasha,15,TODO
T6401,Neque ea fuga neque officiis,MUST,Mike,10,DONE
T6402,In corporis occaecati laboriosam,SHOULD,Joe,1,DONE
T6403,Illo iusto sunt ipsam perspiciatis pariatur esse est,WISH,Joe,10,DOING
T6404,Distinctio eligendi deserunt ipsum asperiores,SHOULD,Joe,2,DONE
T6405,Eaque repudiandae a mollitia porro adipisci,WISH,Mike,10,DONE
T6406,Nostrum quibusdam molestias,SHOULD,Joe,7,DONE
T6407,Dolor fugit laborum pariatur,COULD,Mike,10,DONE
T6408,Soluta dolor quisquam cum,WISH,Natasha,2,DONE
T6409,Molestias architecto aliquam magni culpa saepe,COULD,Natasha,15,DONE
T6410,Cumque sunt dolor,COULD,Natasha,15,DONE
T6411,Excepturi pariatur soluta,MUST,Natasha,10,DONE
T6412,Harum quisquam quo quod,WISH,Natasha,2,TODO
T6413,Facilis quod quaerat,COULD,Joe,10,DONE
T6414,Ipsa ratione voluptatum velit,WISH,Mike,1,DONE
T6415,Eligendi nulla eos,COULD,Joe,2,DOING
T6416,Ad molestiae culpa culpa in,WISH,Joe,10,DONE
T6417,Consequatur repudiandae dolor facere eos,COULD,Natasha,10,TODO
T6418,Omnis aut autem ut nesciunt,COULD,Natasha,2,DONE
T6419,Animi fuga ex,SHOULD,Mike,1,DONE
T6420,Repudiandae blanditiis odio temporibus cum iusto pariatur voluptatem,COULD,Joe,2,DONE
T6421,Repellat sunt rerum,SHOULD,Natasha,1,DONE
T6422,Ipsam iusto ratione id harum occaecati,MUST,Joe,10,DONE
T6423,Minus in magnam numquam maxime,COULD,Joe,2,TODO
T6424,Similique placeat,COULD,Joe,10,DONE
T6425,Cupiditate nobis suscipit,WISH,Joe,15,DONE
T6426,Quia ducimus,COULD,Joe,2,DONE
T6427,Architecto culpa assumenda voluptates dolores,SHOULD,Natasha,2,DONE
T6428,Ex reprehenderit aperiam,WISH,Joe,2,DONE
T6429,Culpa sequi totam optio sed voluptatum,WISH,Natasha,2,DONE
T6430,Officiis vero neque necessitatibus,WISH,Joe,2,TODO
T6431,Facere cupiditate aliquam nobis possimus,SHOULD,Joe,10,DONE
T6432,Ipsa expedita,COULD,Natasha,15,DONE
T6433,Laudantium nostrum iusto molestiae maiores occaecati ut commodi est,MUST,Natasha,10,TODO
T6434,Eos magni harum laborum repellat libero officia eveniet,COULD,Mike,7,DONE
T6435,Ut sint voluptas,COULD,Joe,10,TODO
T6436,Facilis fuga quibusdam,COULD,Joe,15,DONE
T6437,Neque vitae molestiae error ex facere,COULD,Natasha,15,DONE
T6438,Placeat doloremque odio accusantium itaque,COULD,Joe,2,DONE
T6439,Ratione eveniet adipisci corrupti eaque molestias,COULD,Joe,1,DONE
T6440,Ad sunt esse molestiae harum fuga,WISH,Mike,2,TODO
T6441,Perspiciatis delectus recusandae earum aperiam,COULD,Natasha,10,TODO
T6442,Aliquam deleniti tempora porro dolores iste,COULD,Natasha,10,DONE
